477264;GOMITAS MOGUL CEREBRITOS xUN;503;0;0;0;0
477392;GOM MOGUL MORAS x50GR xuni;787;0;0;0;0
477490;MINI REGALIZ BULL DOG FRUTILLA x500g;3989;0;0;0;0
477491;MINI REGALIZ BULL DOG TUTTI-FRUTTI x500g;3989;0;0;0;0
477492;GOMITAS YUMMY BOTELLITAS x500g;4399;0;0;0;0
477493;REGALIZ BULL DOG VIDAL POTE x400g;3884;0;0;0;0
477494;GOMITAS YUMMY FRUT C/CREMA 30gr x12un;4699;0;0;0;0
477495;GOMITAS YUMMY BOTELLITAS 30gr x12un;4699;0;0;0;0
477496;REGALIZ BULL DOG SANDIA 18GR x12un;2899;0;0;0;0
477497;GOMITAS BULL DOG REGALIZ TUT/FRUT 12X18GR;2899;0;0;0;0
477498;GOMITAS BULL DOG REGALIZ FRAMB 12X18G;2899;0;0;0;0
477499;GOMITAS BULL DOG REGALIZ FRUTIL 12X18G;2899;0;0;0;0
477533;YUMMY BOTELLITAS X UNIDAD;367;0;0;0;0
477548;PROMO GOMITAS SUELTAS x1Un.;157;0;0;0;0
478003;GOMAS MISKY FANTASIA ACIDOS x500gr;4304;0;0;0;0
478063;GOMITAS BULL DOG REGALIZ AC TUT/FR X75GR;769;0;0;0;0
478064;GOMITAS BULL DOG POTE FRAMB X360GR;4399;0;0;0;0
478065;GOMITAS BULL DOG POTE FRUTILLA X360GR;4199;0;0;0;0
478066;REGALIZ BULL DOG POTE TUTTI-FRUTTI x360gr;4399;0;0;0;0
478067;GOMITAS BULL DOG POTE SANDIA X360GR;4399;0;0;0;0
478108;DOCILE STICKS VS SAB x12un;2833;0;0;0;0
478111;DOCILE STICKS VARIOS x70gr;943;0;0;0;0
478336;GOMITAS RICOMAS ANILLOS FRUTALES X500GR;2939;0;0;0;0
478443;GOMITAS MOGUL EXTREME OSITOS x500gr;5774;0;0;0;0
478445;GOMITAS MOGUL EXTREME LENGUAS MAX 15gr uni;419;0;0;0;0
478714;GOMITAS MOGUL DIENTES 50gr xuni;787;0;0;0;0
478715;GOMITAS YUMMY GRANEL DIENTES x500g;4399;0;0;0;0
478717;GOMITAS MOGUL JELLY BEANS x500gr;5774;0;0;0;0
478722;GOMITAS MOGUL SANDIA EXTREME X500GR;5774;0;0;0;0
478776;BULL DOG REGALIZ MINI INDV x125g varias;1399;0;0;0;0
478777;GOMITAS BULL DOG FRUTILLA X70GR;769;0;0;0;0
478778;COMITAS BULL DOG REGALIZ C/ACID X60GR;769;0;0;0;0
478832;GOMITAS DORI GUSANOS FRUTAL X500GR;4829;0;0;0;0
478833;GOMITAS DORI CHERRY SOUR X500GR;5499;0;0;0;0
478834;GOMITAS DORI OSITOS X500GR;4829;0;0;0;0
479072;REGALIZ BULL DOG PICANTE ACI+DUL x75g;829;0;0;0;0
479165;GOMITAS BULL DOG REGALIZ ACIDAS X12UN;1889;0;0;0;0
479170;GOMITAS YUMMY HUEVO FRITO x500g;4399;0;0;0;0
479172;GOMITAS MOGUL OSO EXTREME PIC.x12un;455;0;0;0;0
479240;GOMITAS OJOS LOCOS FAKE X30UN;9659;0;0;0;0
479241;GOMITAS EMOJIPOP CANDY PORT X30UN;13019;0;0;0;0
479249;PINCHO FRUTILLA x30un CANDY PORT;12914;0;0;0;0
479253;CANDY ROLL x40un CANDY PORT;22259;0;0;0;0
479259;GOMITAS FRUTITAS LOCAS x30u CANDY PORT;11234;0;0;0;0
479469;REGALIZ BULL DOG TERROR x75g;829;0;0;0;0
479470;GOMITAS YUMMY TERROR x12un;4619;0;0;0;0
479473;REGALIZ BULL DOG PICANTE x12un;2899;0;0;0;0
479595;GOMITAS MOGUL COLA x12Un.;472;0;0;0;0
480012;REGALIZ BULL DOG POTE FRUT x360gr;4399;0;0;0;0
480013;REGALIZ TNT TUBI TWIST x15g x1un;293;0;0;0;0
480014;REGALIZ TNT TUBI TWIST FRUTILLA x15g;293;0;0;0;0
480015;REGALIZ TNT TUBI TWIST FRUTILLA x70g;871;0;0;0;0
480016;GOMITA DORI SOUR BALL x500g;5499;0;0;0;0
480017;GOMITA DORI DELIKET JELLY B. ACIDA x700gr;6404;0;0;0;0
480018;GOMITA DORI DELIKET JELLY B. SURT x700gr;6404;0;0;0;0
480069;GOMITA MOGUL EXTR. JELLY BEANS x50g xun;839;0;0;0;0
480167;OJITOS YUMMY 36Unx10g;11549;0;0;0;0
480226;BOMBON DE FRUTA BILLIKEN CORAZON x200g;2699;0;0;0;0
480602;BOMBON CLASIC BILLIKEN x600g;6599;0;0;0;0
480603;GOMITA YUMMY BANANITA x150g;1399;0;0;0;0
480604;GOMITA YUMMY SANDIA x150g;1399;0;0;0;0
480605;GOMITA YUMMY CIENPIES x150g;1399;0;0;0;0
480606;GOMITA YUMMY OSITOS ACIDO x150g;1399;0;0;0;0
480607;GOMITA YUMMY DIENTES x150gr;1399;0;0;0;0
480608;GOMITA YUMMY FRUTILLA C/CREMA x150g;1399;0;0;0;0
480609;GOMITA YUMMY MORITAS x150g;1399;0;0;0;0
480610;GOMITA YUMMY OSITOS x150g;1399;0;0;0;0
480611;GOMITA YUMMY ACIDAS x150gr;1199;0;0;0;0
480612;GOMITA YUMMY FRUTAL x150g;1199;0;0;0;0
480613;GOMITA YUMMY RUEDITAS x150g;1199;0;0;0;0
480616;GOMITA BILLIKEN TUTTI F. x150g;1199;0;0;0;0
480617;GOMITA BILLIKEN YOGURT x800gr;5099;0;0;0;0
480619;GOMITA PIÑATA ANILLO CRUNCH x700gr;4799;0;0;0;0
480642;GOMITA DORI MORAS x500g;5499;0;0;0;0
480643;GOMITA DORI JELLY BEANS x500g;5499;0;0;0;0
480822;REGALIZ BULL DOG NAVIDAD 12x18gr;2899;0;0;0;0
480831;KIT KIOSCO GAMAGAM x3 +24 BOLSITAS;12199;0;0;0;0
480837;GOMITA GAMAGAM LOVE POTE x500gr;6499;0;0;0;0
480838;GOMITA GAMAGAM BOTONES POTE x500gr;6499;0;0;0;0
480839;GOMITA GAMAGAM ESTRELLITAS POTE x500g;6499;0;0;0;0
481016;GOMITAS MISKY OSITOS x25g;4999;0;0;0;0
481017;GOMITAS MISKY GUSANITOS ACIDOS x25g;4999;0;0;0;0
481018;GOMITAS MISKY FANTASIA x25g;449;0;0;0;0
481019;GOM MOGUL CEREBRITOS PINTA LENGUA x30gr;599;0;0;0;0
481020;GOMITAS MISKY GUSANITOS ACIDOS x500g;4999;0;0;0;0
481021;GOMITAS MISKY DIENTITOS x500g;4999;0;0;0;0
481022;GOMITAS MISKY SANDIAS x500g;4999;0;0;0;0
481023;GOM.MOGUL EXTREM TUBITOS MINI FRUTI x500g;6699;0;0;0;0
481024;GOM.MOGUL EXTREM TUBITOS TUTTI x500g;6699;0;0;0;0
481031;GELATINES FRUTILLA DOCILE x250g;2099;0;0;0;0
481032;GELATINES MIX DIVERTIDO DOCILE x250g;2099;0;0;0;0
481033;GELATINES BANANA DOCILE x250g;2099;0;0;0;0
481034;GELATINES CULEBRITAS ACIDAS DOCILE x250g;2099;0;0;0;0
481035;GELATINES MINI MORAS DOCILE x250gr;2099;0;0;0;0
481036;GELATINES SNACK FOOD DOCILE x250gr;2099;0;0;0;0
1528;TITA X UNIDAD;787;0;0;0;0
2490;BOCADITO OBLITA BCO DCE/LCHE X36U;6899;0;0;0;0
2492;BOCADITO OBLITA MARROC NEGRO X36U;6899;0;0;0;0
2494;BOCADITO OBLITA NEGRO DCE/LCHE X36U;6899;0;0;0;0
2495;BOMBON OBLITA BLANCO x30un;6499;0;0;0;0
2496;BOMBON OBLITA CHOCOLATE x30un;6499;0;0;0;0
2497;BOMBON OBLITA CLASICO x30un;6499;0;0;0;0
2498;CUBANITO OBLITA CHOCOLATE x48un;3699;0;0;0;0
2499;CUBANITO OBLITA FRUTILLA x48un;3699;0;0;0;0
2500;CUBANITO OBLITA MARROC X48U;3699;0;0;0;0
2501;CUBANITO OBLITA NOUGAT x48un;3359;0;0;0;0
2502;CUBANITO OBLITA DCE LECHE x48un;3699;0;0;0;0
2503;OBLEA OBLITA BAÑADA BLANCA X28g uni;524;0;0;0;0
2504;OBLEA OBLITA BAÑADA NEGRA X 28g uni;524;0;0;0;0
2617;RHODESIA X UNIDAD;899;0;0;0;0
3481;OBLEAS GAONA SINFONIA x100g CLASICA;639;0;0;0;0
3526;OBLEAS GAONA SINFONIA x100g FRUTILLA;661;0;0;0;0
6550;CUBANITO OBLITA NAVIDEÑO MARROC x15Un.;4094;0;0;0;0
7449;CUBANITO OBLITA CHOC/BCO x48un;3359;0;0;0;0
8871;OBLEA SMACK RELL CH/MANI x33g;251;0;0;0;0
12099;CHOC. MILKA CHOCO PAUSE OREO x45gr;944;0;0;0;769
60630;OBLEA MENTECOL X27GR;790;0;0;0;0
466085;OBLEA BAÑADA TYM X20G;241;0;0;0;0
472773;RHODESIA CHOCOLATE X 22G;628;0;0;0;0
474075;CHOCO FAN BLANCO x37g;283;0;0;0;0
474387;OBLEA HAMLETON x28g;440;0;0;0;0
474503;OBLEA GOLAZO AMBROFOLI x18g;83;0;0;0;0
475213;BARRA MARROC BAÑO BLANCO TYM x27gr;367;0;0;0;0
475214;BARRA MARROC BAÑO SEMIAMARGO TYM x27g;367;0;0;0;0
476474;OBLEA TYM BAÑADA X5U;630;0;0;0;0
477064;CHOKOBOMB TYM x50gr;944;0;0;0;0
478434;CUBANITO R/DULCE DE LECHE XUN;366;0;0;0;0
479704;GOLOSINA SUELTA frutita loca x1;367;0;0;0;0
480845;CUBANITO TUBIN BRIGADEIRO x48gr;549;0;0;0;0
480846;CUBANITO TUBIN NAPOLITANO x48g;549;0;0;0;0
481013;OBLEA COFLER BLOCK MAX x60g;1399;0;0;0;0
481014;OBLEA COFLER MAX CHOCOLINAS x60g;1399;0;0;0;0
481015;OBLEA COFLER MAX AVELLANAS x60g;1399;0;0;0;0
481111;CUBANITO TUBIN TRUFAS x48g;549;0;0;0;0
198;ALF. AGUILA MINITORTA BROWNIE;1259;0;0;0;0
199;ALF. AGUILA MINITORTA CLASICO;1259;0;0;0;0
207;ALF. FULBITO CHOCOLATE x30G;199;0;0;0;0
212;ALF. GUAYMALLEN SIMP CHOC x38g;272;0;0;0;0
214;ALF. JORGELIN BLANCO x1un;1175;0;0;0;0
215;ALF. JORGITO CHOCO x55gr;892;0;0;0;0
216;ALF. JORGITO BCO LECHE x55gr;892;0;0;0;0
227;ALF. TURIMAR TRIPLE NEGRO X60gr;399;0;0;0;0
228;ALF. TURIMAR TRIPLE BCO X60gr;399;0;0;0;0
237;ALF. VAUQUITA NEGRO X80GR;999;0;0;0;0
238;ALF. VIMAR BCO x38g;241;0;0;0;0
239;ALF. VIMAR SIMPLE CHOC x38g;241;0;0;0;0
244;ALF. VIMAR TRIPLE BCO x60g;209;0;0;0;0
1684;ALF. GUAYMALLEN TRIPLE LECHE;453;0;0;0;0
1685;ALF. GUAYMALLEN TRIPLE CHOC;453;0;0;0;0
2316;ALF. RAPSODIA MINI TORTA;579;0;0;0;0
3527;ALF. VAUQUITA CAPUCCINO X72GR;999;0;0;0;0
3957;ALF. GUAYMALLEN SIMP FRUTA x38g;272;0;0;0;0
4157;ALF. GUAYMALLEN SIMP LECHE x38g;272;0;0;0;0
4253;ALF. BON O BON TRIP CHOC x60g;1259;0;0;0;0
4352;ALF. JORGITO TUBO BCO x6un x160gr;2624;0;0;0;0
4423;ALF. JORGELIN NEGRO x1un;1175;0;0;0;0
4424;ALF. MILKA TRIP MOUSSE CHOC;1469;0;0;0;1399
4425;ALF. OREO TRIPLE x56g;1469;0;0;0;1399
4426;ALF. PEPITOS TRIPLE x57gr;1363;0;0;0;1399
4427;ALF. COFLER BLOCK TRIPLE x1Un;1259;0;0;0;0
4529;ALF. TERRABUSI CLAS. CHOC x50g;1049;0;0;0;0
4530;ALF. TERRABUSI TRIPLE CHOC x70g;1469;0;0;0;0
4620;ALF. MILKA TRIPLE DCE LECHE 70GR;1469;0;0;0;0
4621;ALF. MILKA OREO TRIPLE;1469;0;0;0;1399
4626;ALF. SHOT TRIPLE CHOC x60gr;1469;0;0;0;1490
4627;ALF. BON O BON BLANCO x40gr;787;0;0;0;0
4628;ALF. BON O BON NEGRO x40gr;787;0;0;0;0
4695;ALF. AGUILA MINI TORTA COCO;1259;0;0;0;0
4877;ALF. VAUQUITA GLASEADO x72gr;1049;0;0;0;0
4969;ALF. JORGITO TUBO GLASEADO x6un x160gr;2624;0;0;0;0
4970;ALF. JORGITO TUBO CHOC x6un x160gr;2624;0;0;0;0
5493;ALF. TERRABUSI TRIPLE CLAS. x70gr;1469;0;0;0;1399
5987;ALF. TOFI TRIPLE BCO;1363;0;0;0;0
5988;ALF. TOFI TRIPLE NEGRO;1363;0;0;0;0
6443;ALF. B&N BAGLEY BCO x73g;1349;0;0;0;0
6445;ALF. B&N BAGLEY NEGRO x73g;1349;0;0;0;0
6447;ALF. AGUILA MINITORTA BLANCO;1259;0;0;0;0
7546;ALF. JORGITO TUBO MOUSSE x6un x160gr;2099;0;0;0;0
7547;ALF. JORGITO TUBO FRUTA x6un x160gr;2099;0;0;0;0
7783;COPITO CAJA PABLITO X2KG;16490;0;0;0;0
7784;ALF. PABLITO MAIZENA x2Kg;14999;0;0;0;0
7785;ALF. PABLITO x2Kg;15390;0;0;0;0
8770;ALF. CHOCOARROZ MARROC X22gr;944;0;0;0;0
8791;ALF. CAPITAN DEL ESPACIO TRIPLE CHOC X80gr;1973;0;0;0;0
8792;ALF. CAPITAN DEL ESPACIO SIMPLE LECHE x40gr;1280;0;0;0;0
8793;ALF. CAPITAN DEL ESPACIO SIMPLE CHOC x40gr;1280;0;0;0;0
9945;ALF. GENIO BLANCO TRIPLE X60gr;349;0;0;0;0
9946;ALF. GENIO NEGRO TRIPLE X60gr;349;0;0;0;0
11193;ALF. FULBITO MANI x30g;199;0;0;0;0
12274;ALF. SUBOM CHOCOLATE 6X140gr;1112;0;0;0;0
12275;ALF. SUBOM CHOC/BCO x6Un;1112;0;0;0;0
12276;ALF. SUBOM MAIZENA x6Un;1112;0;0;0;0
60612;ALF. SHOT TRIPLE CHOCO BCO X60g;1490;0;0;0;0
460766;ALF. CAPITAN DEL ESPACIO FRUTA X40gr;1212;0;0;0;0
463122;ALF. GUAYMALLEN SIMP ORO x48g;703;0;0;0;0
463759;ALF. MILKA MOUSSE BCO TRIPLE x55gr;1469;0;0;0;1399
463760;ALF. TITA X36gr;569;0;0;0;690
465094;ALF. VALIDO MAIZENA X140gr;1199;0;0;0;0
465095;ALF. VALIDO NEGRO x155gr;1349;0;0;0;0
465720;ALF. MILKA MOUSSE SIMPLE CHOC X42gr;734;0;0;0;0
466888;ALF. TOFI SIMP CHOC x46g;503;0;0;0;0
467331;ALF. FANTOCHE TRIPLE CHOC x85g;787;0;0;0;0
467332;ALF. FANTOCHE TRIPLE BCO x85g;787;0;0;0;0
467333;ALF. BLANCO SIMPLE LA ALDEA X60G;1099;0;0;0;0
467334;ALF. CHOCO SIMPLE LA ALDEA X65G;1099;0;0;0;0
467335;ALF. BLANCO BOMBA LA ALDEA X58G;1049;0;0;0;0
467336;ALF. CHOCO BOMBA LA ALDEA X58G;1049;0;0;0;0
467337;ALF. MAICENA LA ALDEA X80G;1099;0;0;0;0
467338;ALF. BLANCO LA RECOVA X60G;679;0;0;0;0
467339;ALF. CHOCO LA RECOVA X60G;679;0;0;0;0
467355;ALF. BLANCO VAUQUITA JUNIOR X60G;500;0;0;0;0
467356;ALF. NEGRO VAUQUITA JUNIOR X60G;500;0;0;0;0
468196;ALF. VIMAR ESCOLAR x1Un;178;0;0;0;0
470113;ALF. FANTOCHE NIGHT TRIP x85g;818;0;0;0;0
470114;ALF. FANTOCHE DAY TRIP x85g;818;0;0;0;0
470270;ALF. BON O BON MINI x6Un;2624;0;0;0;0
470271;ALF. JORGELIN GLASEADO x85g;1175;0;0;0;0
470273;ALF. CHOCOARROZ LIMON X22gr;944;0;0;0;0
470274;ALF. CHOCOARROZ DCE DE LECHE X22gr;944;0;0;0;0
471875;ALF. JORGITO SIMPLE FRUTA x55gr;713;0;0;0;0
473093;ALF. TERRABUSI GLASEADO x38g;1049;0;0;0;0
473993;ALF. TERRABUSI CLAS x6u;4999;0;0;0;0
474637;ALF. CHOCOARROZ BCO x22g;944;0;0;0;0
475991;ALF. FANTOCHE SIMPLE DAY x50g;566;0;0;0;0
476395;ALF. MARLEY SIMPLE NEGRO X80GR;839;0;0;0;0
476473;ALF. RASTA SIMPLE NEGRO X70gr;933;0;0;0;0
476724;ALF HAMLET CHOC x36 gr;379;0;0;0;0
477042;ALF. CABO BLANCO CHOCOLATE X5un;1279;0;0;0;0
477043;ALF. CABO BLANCO CHOC.BCO X5un;1279;0;0;0;0
477044;ALF. CABO BLANCO MAIZENA X5un;1279;0;0;0;0
477213;ALF. CHOCO ARROZ FRUTILLA X22gr;944;0;0;0;0
477341;ALF. CABO BLANCO BLANCO X1un;824;0;0;0;0
477343;ALF. CABO BLANCO CHOCO X1un;976;0;0;0;0
478227;ALF. EMILIO MAIZENA X72gr;629;0;0;0;0
478332;ALF. COFLER CHOCO CREAMY TRIPLE x60g;1049;0;0;0;0
478398;OREO BAÑADAS CHOCO x119gr;3674;0;0;0;0
478399;OREO BAÑADAS CHOCO BCO x119gr;3674;0;0;0;0
478941;ALF. DON BARCCELO AMARGO MIXTO X1un;944;0;0;0;0
479016;ALF. COFLER BLOCK SIMPLE X40gr;787;0;0;0;0
479031;ALF. VALIDO BLANCO X155gr;1349;0;0;0;0
479111;ALF. LUKA LECHE/CHOC X90gr;1399;0;0;0;0
479113;ALF. RASTA SIMPLE BLANCO X70gr;933;0;0;0;0
479175;ALF. CHOCOTORTA TRIPLE X71,5gr;1259;0;0;0;0
479177;ALF. GORDINFLON CHOC X85gr;944;0;0;0;0
479188;ALF. HAMLET SIMPLE CHOCOMANI X34,5gr;379;0;0;0;0
479189;ALF. ZUCOA MOUSSE x35g;472;0;0;0;0
479365;ALF. BARRIGON NEGRO X70GR;999;0;0;0;0
479366;ALF. BARRIGON NEGRO MEGA X100GR;1699;0;0;0;0
479402;ALF. DE SIATO SIMPLE BLANCO x70gr;838;0;0;0;0
479403;ALF. DE SIATO SIMPLE NEGRO x70gr;838;0;0;0;0
479420;ALF. GUAYMALLEN PLATINO DDL X50GR;524;0;0;0;0
479710;ALF. MARLEY SIMPLE BCO X80GR;839;0;0;0;0
479711;ALF. MARLEY TRIPLE NEGRO X100GR;1249;0;0;0;0
479712;ALF. MARLEY TRIPLE BCO X100GR;1249;0;0;0;0
479877;ALF. CHICAMA CHOCOLATE X70GR;899;0;0;0;0
480324;ALF. BON O BON TRIPLE BCO X60g;1259;0;0;0;0
480451;ALFAJOR CHOCOLATE GULA KING X 72G;1049;0;0;0;0
480459;ALF. GULA CHOCO NEGRO X72g;1049;0;0;0;0
480460;ALF. GULA CHOCO BCO X72g;1049;0;0;0;0
480547;ALF. BARRIGON BCO MEGA x100g;1699;0;0;0;0
480548;ALF. BARRIGON BCO x70g;999;0;0;0;0
480549;ALF. BARRIGON TRIPLE FRUTILLA X100g;1699;0;0;0;0
480550;ALF. BARRIGON DE BARRIO X45g;479;0;0;0;0
480553;SMACK TORTA DULCE DE LECHE x70g;539;0;0;0;0
480569;ALFAJOR CHESCO BLACK x65g;999;0;0;0;0
480570;ALF FANTOCHE PESCADO RAUL BCO x50g;699;0;0;0;0
480575;ALF FANTOCHE PESCADO RAUL NEGRO x50g;699;0;0;0;0
480576;ALF FANTOCHE RED VELVET TRIPLE x100g;999;0;0;0;0
480577;ALF COFLER MOUSSE SIMPLE x40g;789;0;0;0;0
480585;ALF PAMELA TRIPLE NEGRO x60g;399;0;0;0;0
480586;ALF PAMELA TRIPLE BLANCO x60g;399;0;0;0;0
480587;ALF FULL MANI GEORGALOS x40g;629;0;0;0;0
480647;ALF VAUQUITA BCO x72g;1049;0;0;0;0
480710;ALF CAMPEONES DEL MUNDO x75g;1599;0;0;0;0
480711;PALITOS PABLITO x1.5Kg;13999;0;0;0;0
480843;ALF MANTECOL SIMPLE x40gr;849;0;0;0;799
480844;ALF. MANTECOL TRIPLE X60g;1299;0;0;0;0
480903;BOMBA EXTREMA GULA x64g;1049;0;0;0;0
480942;ALF. BARRIGON BROWNIES X100g;1699;0;0;0;0
480943;ALF BARRIGON CREMA Y DCE LECHE x100g;1699;0;0;0;0
481025;ALF FANTOCHE SUPER TRIPLE x100g;999;0;0;0;0
481052;ALF. MB BOB CHOCO X70g;849;0;0;0;0
481053;ALF. MR BOB BCO X70g;849;0;0;0;0
481125;ALFAJOR ORENSE BLANCO x60g;899;0;0;0;0
481134;ALFAJOR ORENSE NEGRO x65g;899;0;0;0;0
5424;CEREAL MIX CHOCOLATE/ALMENDRAS;787;0;0;0;0
5495;CEREAL MIX LIGHT YOG FRUTILLA;787;0;0;0;0
6350;CEREAL MIX LIGHT MANZANA;787;0;0;0;0
6351;CEREAL MIX PASION DE CHOCOLATE;787;0;0;0;0
6352;CEREAL MIX YOGURT FRUTILLA;713;0;0;0;0
6540;CEREAL FORT VARIOS;598;0;0;0;0
7074;CEREAL MIX LIGHT ORIGINAL 23g;787;0;0;0;0
8294;TORRONCINO 23G FELFORT XUNID;1745;0;0;0;0
9439;TORRONCINO 5 CEREALES LIGHT X UNIDAD;1745;0;0;0;0
467740;FLOW CEREAL GEORGALOS VARIOS X23gr;419;0;0;0;699
467742;FLOW CEREAL C/ALMENDRAS GEORGALOS VARIO;482;0;0;0;0
472448;CEREAL MIX FLLA/CHOCO x26g;787;0;0;0;0
480620;BARRA CEREAL BILLIKEN FLLA Y YOGURT x25g;469;0;0;0;0
480621;BARRA CEREAL BILLIKEN MANZANA x21g;469;0;0;0;0
1731;HELADITOS VICTORIO PAYSANDU X25un;1469;0;0;0;0
3060;SAPITO CHOCOLATOSO x24un;4304;0;0;0;0
3061;SAPITO DULCE DE LECHE x24un.;4304;0;0;0;0
3062;SAPITO FRUTILLA x24un;4304;0;0;0;0
3063;SAPITO CHOC NGO/BCO C/MANI x24un;4304;0;0;0;0
4636;BOCADITO HOLANDA 525G;10499;0;0;0;0
7223;BOTELLITAS LICOR FELFORT (X UNIDAD);1049;0;0;0;0
7309;HUESITO/BANANITA FRUTALES TIRA x10un;314;0;0;0;0
24100;BOCADITO CHOCOLATE TURIMAR XUN;599;0;0;0;0
45412;MERENGUITOS TUCU;2190;0;0;0;0
460569;HUESITO CHOCO TIRA X 10u;367;0;0;0;0
462170;HELADITOS SECO EL GORDITO x25Un.;2519;0;0;0;0
462171;GALLINITA C/JUGUITO EL GORDITO x25Un.;2624;0;0;0;0
465566;KOOKY BON MARROC FELFORT x10g;388;0;0;0;0
469409;CANUTIÑO GIGANTE C/BILLETE x50Un.;1679;0;0;0;0
476262;CABSHA MARROC x24U 240gr;5239;0;0;0;0
476263;CABSHA AVELLANAS x24u 240gr;5239;0;0;0;0
477113;GALLINITA EL ROCIO PAYSANDU x25un;4999;0;0;0;0
479168;SAPITO ACIDO x24un;4304;0;0;0;0
479169;SAPITO PICANTE x24 un;4304;0;0;0;0
479385;CUBANITOS CUBACOA x30un;3149;0;0;0;0
547;BOMBONES SURTIDO ESPECIAL x223g;4724;0;0;0;0
1114;BOMBONES SURTIDOS DANCING CAJA x50un;7999;0;0;0;0
4183;CHUP.CORAZON N1 ROMAN PAYSANDU x12un;2999;0;0;0;0
4524;OBLEA LECHE BON O BON X30G NEGRA;839;0;0;0;0
4525;OBLEA BLANCO BON O BON X30G;839;0;0;0;0
5701;CHOCOLATE MARROC (X UNIDAD);734;0;0;0;0
6381;BON O BON SUELTO x3Un;1399;0;0;0;0
7133;BOMBONES GAROTO x250g;5999;0;0;0;0
7248;BOMBON JACKELINE FELFORT (X UNIDAD);1049;0;0;0;0
8337;BOMBONES SURTIDOS BELL x450g;6599;0;0;0;0
8511;BOMBON MOGUL x500g FRUTA;4409;0;0;3699;0
9607;BOMBON FERRERO ROCHER X3U 37G;1468;0;0;0;0
9608;FERRERO ROCHER X8U 100G;4189;0;0;0;0
9796;OBLEA XL LECHE BON O BON x45gr;1259;0;0;0;0
9975;RELLENO UNTABLE BONOBON 290g;4829;0;0;0;0
460220;OBLITA BOMBON FRUTILLA x30u;6499;0;0;0;0
460269;BOMBON OBLITA CRASH x30un;6499;0;0;0;0
462525;BON O BON CLASICO x450g;13544;0;0;0;0
465044;BON O BON AGUILA x270g;7559;0;0;0;0
465045;BON O BON BLANCO x450g;13544;0;0;0;0
465046;BON O BON CHOCOLINAS x270g;7559;0;0;0;0
465065;KROOMY FRUTILLA x10g x24u;4299;0;0;0;0
465395;MEDALLON DDL FELFORT x21g;944;0;0;0;0
465835;BOMBONES ARCOR SELECCION x247g;8294;0;0;0;0
467095;BON O BON SURTIDO x255g;8714;0;0;0;0
467435;BOMBON NESTLE ESPECIALIDADES x215g;5774;0;0;0;0
468111;BOMBON OBLITA x5u;871;0;0;0;0
469992;RELLENO UNTABLE COFLER BLOCK x290g;4829;0;0;0;0
472213;FERRERO ROCHER x12 x150g;6823;0;0;0;0
472939;CONITOS SANTA INES;419;0;0;0;0
474497;BOMBON MILKA OREO 11un x209g;7349;0;0;0;0
476305;BON O BON COCO x270gr;5668;0;0;0;0
477134;FERRERO XUNI;409;0;0;0;0
480307;BOMBON HAMLET COOKIES&CREAM x450g;8189;0;0;0;0
481117;BOMBONES DADINHO ESPECIALIDADES x198g;3999;0;0;0;0
481118;BOMBONES DADINHO EXCLUSIVIDADES x185g;3999;0;0;0;0
817;CONFITES PLATEADOS CENTURION 50g;327;0;0;0;0
1104;PAST ANIS DRF X12U;2999;0;0;0;0
1105;PAST FRUTOS ROJOS DRF X12U;2999;0;0;0;0
1106;PAST MENTA DRF X12U;2999;0;0;0;0
1107;DRF NARANJA x12u;2999;0;0;0;0
1690;CARAMELOS HALLS FRESH x12Un.;7874;0;0;0;0
1691;HALLS MENTA-LYPTUS X12U;7874;0;0;0;0
2261;MENTHOPLUS CEREZA x12u;5774;0;0;0;0
2262;MENTHOPLUS MENTA x12u;5984;0;0;0;0
2263;MENTHOPLUS STRONG x12u;5984;0;0;0;0
2264;MENTITAS DCE LECHE KIDS X12U;3999;0;0;0;0
2265;MENTITAS CHEERRY LACASA X12U;3999;0;0;0;0
2266;MENTITAS DCE LECHE LACASA X12U;4199;0;0;0;0
2267;MENTITAS FRUTAL LACASA X12U;3999;0;0;0;0
2268;MENTITAS MENTA LACASA X12U;4199;0;0;0;0
2618;PASTILLAS BULL DOG MAND/UVA-SANDIA x12un;4199;0;0;0;0
2931;TIC TAC MIX DE FRUTAS X12U;12074;0;0;0;0
3225;BULL DOG PASTILLAS TUTTI-FRUTTI x12un;4199;0;0;0;0
3234;PASTILLAS BULL DOG MIX TUTTI/LIMON x12U;4199;0;0;0;0
3235;BULL DOG PASTILLAS MANDARINA x30g;4094;0;0;0;0
3280;PASTILLAS BULL DOG UVA x12un;4199;0;0;0;0
3301;BULL DOG PASTILLAS MANZANA x30g;4199;0;0;0;0
3351;TIC TAC MENTA x12u;12074;0;0;0;0
3352;TIC TAC NARANJA x12u;12074;0;0;0;0
3381;PASTILLAS BULL DOG MIX SANDIA/MZA x12UN;4199;0;0;0;0
3521;VARITA MAGICA x12u FACUNDITO PAYSANDU;2699;0;0;0;0
3821;PASTILLAS FREEGELLS TNT ATOM.APPLE x12Un.;2699;0;0;0;0
3902;PASTILLAS FREEGELLS TNT BERRY BLAST x12Un.;2699;0;0;0;0
3908;PASTILLAS FREEGELLS FRESH MELON CRISTx12U;2699;0;0;0;0
3909;PASTILLAS FREEGELLS MENTA C/CHOCO x12Un.;2699;0;0;0;0
3926;PASTILLAS FREEGELLS EUCALIPTO MENTOL x12Un.;2699;0;0;0;0
3970;HALLS CHERRY X12UNIDADE;7874;0;0;0;0
3971;HALLS STRONG X12UNIDADE;7999;0;0;0;0
3991;PASTILLAS FREEGELLS EXT FUERT MENTOLx12U;2624;0;0;0;0
3994;PASTILLAS FREEGELLS FRUTILLA C/CHOCO x12Un.;2699;0;0;0;0
3995;PASTILLAS FREEGELLS FRUTOS ROJOS x12Un.;2624;0;0;0;0
4272;MENTITAS TUTTI FRUTTI KIDS X12U;3999;0;0;0;0
4273;MENTITAS BANANA KIDS 12U;4199;0;0;0;0
4323;PAST CITRUS DRF X12U;2999;0;0;0;0
4745;PAST MENTOL DRF X12U;2999;0;0;0;0
5661;PASTILLA MINI CLIX12 TUTTI Fx290g;2172;0;0;0;0
5662;PASTILLA MINI CLIX5 TUTTI Fx240g;1963;0;0;0;0
5664;PASTILLA MINI CLIX RENOME x350g;2624;0;0;0;0
5666;RENOME PAST BSA CLIX 350G;2309;0;0;0;0
5875;MENTHOPLUS MIEL x12u;5774;0;0;0;0
5876;MENTHOPLUS MENTOL x12u;5774;0;0;0;0
5878;MENTHOPLUS S/A MENTOL ZERO x12u;7769;0;0;0;0
5880;MENTHOPLUS S/A CHERRY x12u;7769;0;0;0;0
5881;MENTHOPLUS S/A STRONG x12u;7769;0;0;0;0
6001;BULL DOG CRAZY X10U;5599;0;0;0;0
6060;ROMPEMUELAS x50un;4499;0;0;0;0
6804;HALLS MENTHO LYP 12u;7874;0;0;0;0
6911;HALLS MIEL Y LIMON x12u;7999;0;0;0;0
6912;HALLS MIEL Y MENTA x12u;7874;0;0;0;0
7310;GOTITAS FRUTALES TIRA X 10UNI;314;0;0;0;0
7326;PAST BIYU GRAN SORPRESA X12u;12990;0;0;0;0
8027;PASTILLAS DOCILE MINI 8 x192g;2204;0;0;0;0
8684;PAST. YIPI 12U X30G;2834;0;0;0;0
9335;TIC TAC FRUTILLA Y CREMA x12Un.;12074;0;0;0;0
9686;MONSTERS CANDY TOY CONFITES x15g;2204;0;0;0;0
461078;PASTILLAS LA YAPA x17g X36UNI;10799;0;0;0;0
461667;MENTITAS LACASA FRUTAL x5Un.;3464;0;0;0;0
463367;PASTILLA MINI 8 TUTTI F x385g;2382;0;0;0;0
463371;PAST. CLIX CLASICA x50Un.;2099;0;0;0;0
463757;PAST LIMON DRF X12U;2999;0;0;0;0
463758;DRF SURTIDAS X24UNI;7499;0;0;0;0
464778;TICTAC x6;2252;0;0;0;0
466636;PASTILLAS FREEGELLS MENTA x12u;2699;0;0;0;0
466736;PASTILLAS DRINK CANDY X24UNI;9449;0;0;0;0
467388;BULL DOG UNIDADx30g;260;0;0;0;0
467908;MENTHOPLUS/BELDENT 1UN;750;0;0;0;0
468249;PASTILLAS ALKA x12Un.;3149;0;0;0;0
470041;PASTILLAS EN BOLSA VARIAS x500gr;1007;0;0;0;0
470477;PASTILLA LA YAPA X 1un;262;0;0;0;0
470494;PAST. CORAZONCITOS DORINS VS 20x25g;3664;0;0;0;0
471405;PASTILLAS MINI8 LUCKY x385g;2999;0;0;0;0
471893;PASTILLA BLUPER BSA x400g;3299;0;0;0;0
472003;MENTITAS LACASA SANDIA x12Un.;3999;0;0;0;0
472453;PAST MINI LUCKY 8 VARIAS x200g;1511;0;0;0;0
474032;PASTILLA YIPI XUNIDAD;125;0;0;0;0
474041;TIC TAC VARIOS POR UNIDAD;1049;0;0;0;0
474225;TIC TAC MENTA FUERTE x12Un.;7864;0;0;0;0
474310;PASTILLAS BLUPERS TIRA x6Un.;566;0;0;0;0
474616;DRF X UNIDAD;209;0;0;0;0
475149;HALLS FRUTILLA/CHERRY x12Un.;7874;0;0;0;0
475150;HALLS NARANJA x12Un.;7874;0;0;0;0
475339;MENTITAS D.R.F. VARIAS XUN;272;0;0;0;0
476265;PASTILLAS BULL DOG x30g;315;0;0;0;0
476293;PASTILLA LUCKY MINI 12 x290gr;2399;0;0;0;0
476294;PASTILLA LUCKY MINI 5 x240gr;2299;0;0;0;0
476295;PASTILLA MINI8 x385g;2257;0;0;0;0
477104;PASTILLAS DORIN`S X1 UN;208;0;0;0;0
477781;PAST BULL DOG SUELTAS X 1;315;0;0;0;0
478095;PAST.PUNCH BILLIKEN x60un;4390;0;0;0;0
478185;PASTILLITAS MEGA BLUPER x336g;2999;0;0;0;0
479314;MAMADERA BLUPER x65g x1un;2199;0;0;0;0
480600;REG. BULL DOG ROLL x24un;15490;0;0;0;0
480601;PAST. DRF MENTA LATA x22gr;2299;0;0;0;0
480931;BOT C/DESTAPADOR PAST. BLUPER x65g x1un;2199;0;0;0;0
1054;MALVAVISCOS GONGYS X200g;1999;0;0;0;0
1059;MALVAVISCOS BUFFYS VARIOS X450g;4724;0;0;0;0
3508;BUFFYS MALVAVISCOS TRADICIONAL x200g;2099;0;0;0;0
3549;BUFFYS MALVAVISCOS CORAZON x200g;2099;0;0;0;0
3551;BUFFYS MALVAVISCOS CHURRO FRESA x450g;4724;0;0;0;0
3552;BUFFYS MALVAVISCOS FORMAS FRUTAL x450g;4724;0;0;0;0
3594;BYFFYS MALVAVISCOS TWISTER FRESA x450g;4724;0;0;0;0
3608;MALVAVISCOS BUFFYS STICK FRUTAL X12g;272;0;0;0;0
3623;MALVAVISCOS BUFFYS STICK FRESA X12g;293;0;0;0;0
3639;MALVAVISCOS BUFFYS TWISTER FRUTAL X20g;262;0;0;0;0
3661;MALVAVISCOS BUFFYS FRESA X20g;262;0;0;0;0
3762;BUFFYS MALVAVISCOS FORMAS FRUTAL x200g;1994;0;0;0;0
3786;BUFFYS MALVAVISCOS CORAZON FRESA x450g;4724;0;0;0;0
3811;BUFFYS MALVAVISCOS TWISTER FRUTAL x200g;2099;0;0;0;0
7666;GONGYS MALVAVISCOS VARIOS X 28 G;349;0;0;0;0
8847;MALVAVISCOS BAFFYS VARIOS X200g;2099;0;0;0;0
465053;BUFFYS MALVAVISCOS 125G CORAZON;1784;0;0;0;0
465054;BUFFYS MALVAVISCOS 125G TWISTER;1784;0;0;0;0
465055;BUFFYS MALVAVISCOS 125G TWISTER FRUTAL;1784;0;0;0;0
465056;BUFFYS MALVAVISCOS 125G FORMAS;1784;0;0;0;0
465541;BUFFYS MALVAVISCO x20G;251;0;0;0;0
471884;MERENGUES MEDIANOS BLANCO LA AMISTAD x100g;1973;0;0;0;0
473283;BUFFYS STICK-MALLOW x12GR;272;0;0;0;0
3094;TEMBLEKE BRUJA POR UNIDAD;535;0;0;0;0
6967;TEMBLEKE VARIOS xUN x32g RELOJ/COBRA;999;0;0;0;0
10331;TEMBLEKE TREMBLY PIRATA TIRA x6un;755;0;0;0;0
462080;TREMBLY SELVA TIRA x6un;944;0;0;0;0
466735;TEMBLEKE ASKIRATA X32G;999;0;0;0;0
475047;TEMBLEKE CANDY ICE x450g;2057;0;0;0;0
479772;TEMBLEKE TUTTI FRUTTI x6u;1199;0;0;0;0
480853;EXHIBIDOR + 20 TIRAS TEMBLEKE VARIOS;23999;0;0;0;0
2218;MANTECOL x404g;3989;0;0;0;0
2462;NUCREM GEORGALOS x 84 GR;282;0;0;0;0
3772;MANTECOL CLASICO X250G;4409;0;0;0;0
3804;NUCREM GEORGALOS CLASICO x290gr;1889;0;0;0;0
472702;NUCREM GEORGALOS x35g;104;0;0;0;0
477751;MANTECOL LINGOTE DE ORO x500g;6299;0;0;0;0
478382;MANTECOL UNTABLE FCO x250g;4699;0;0;0;0
4420;HUEVO KINDER GRAN SOR 150G VARIOS;26249;0;0;0;0
6624;HUEVO KINDER SORPRESA 100g;11024;0;0;0;0
6629;HUEVO FELFORT PIRATAS x200gr;14699;0;0;0;0
6631;HUEVO FELFORT MARROC x200gr;14699;0;0;0;0
6632;HUEVO FELFORT DOS CORAZONES x200gr;14699;0;0;0;0
9426;HUEVO JACK FELFORT x14G;2899;0;0;0;0
462811;HUEVO FELFORT CON SORPRESA x 17g;1312;0;0;0;0
462877;HUEVO DE PASCUA REAL N.4 x90g;5249;0;0;0;0
462879;HUEVO DE PASCUA REAL N.7 x220g;12809;0;0;0;0
462912;HUEVO ITALIANO CHOOK X 100 G;4199;0;0;0;0
463384;HUEVO SAPITO CONFITES x30g;7821;0;0;0;0
466904;HUEVO DE PASCUA TUCU N7;1890;0;0;0;0
466907;HUEVO DE PASCUA REAL N.5 x130g;7559;0;0;0;0
466908;HUEVO DE PASCUA REAL N.6 x180g;10499;0;0;0;0
466915;HUEVO DE PASCUA TUCU N9;2520;0;0;0;0
466921;HUEVO DE PASCUA TUCU N10;3045;0;0;0;0
472214;HUEVO DE PASCUA ALTEZA C/CONFITES x22gr;1049;0;0;0;0
472215;HUEVO D/PASCUAS GEORGALOS C/BOMBON x75gr;3674;0;0;0;0
472216;HUEVO D/PASCUAS GEORGALOS C/BOMBON x145gr;7874;0;0;0;0
473548;HUEVO TOCA TOCA C/SORPRESA x15g;419;0;0;0;0
474059;HUEVO PASCUA ALTEZA C/CONFITES x45gr;1679;0;0;0;0
474060;HUEVO DE PASCUAS GEORGALOS C/CONF X22G;293;0;0;0;0
474061;HUEVO DE PASCUAS BULL DOG X 200G;10499;0;0;0;0
474062;HUEVO PASCUAS TODDY X45 G;577;0;0;0;0
474063;HUEVO PASCUAS TODDY X 126G;2834;0;0;0;0
474064;HUEVO PASCUA TOKKE C/BOMBON X 152G;2509;0;0;0;0
475890;HUEVO D/PASCUA YUMMY x220g;10499;0;0;0;0
478338;HUEVO ALTEZA C/CONFITES x75g;3359;0;0;0;0
478339;HUEVO MANTECOL C/BOCADITO x200g;10489;0;0;0;0
478340;HUEVO MANTECOL C/CONFITES x22GR xUNI;1207;0;0;0;0
478341;HUEVO TODDY C/CONFITES x22gr XUNI;1207;0;0;0;0
478342;HUEVO TODDY C/CEREALES x75g;3148;0;0;0;0
478343;HUEVO MECANO BONAFIDE x115g;8294;0;0;0;0
478344;HUEVO VIZZIO RELL/ALMENDR. x167g;10078;0;0;0;0
478345;HUEVO VIZZIO RELL/ALMENDR. x87g;5249;0;0;0;0
478346;HUEVO NUGATON x177g;9449;0;0;0;0
478347;HUEVO NUGATON x91gr;5143;0;0;0;0
