92;ACEITE CAÑUELAS GIRASOL x900ml;3299;0;0;0;0
93;ACEITE CAÑUELAS GIRASOL x1.5Lt;4999;0;0;0;0
94;ACEITE COCINERO GIRASOL x900ml;3199;0;0;0;0
95;ACEITE COCINERO GIRASOL X1.5 Lt;5399;0;0;0;0
101;ACEITE NATURA GIRASOL x3Lt.;11999;0;0;0;0
102;ACEITE NATURA GIRASOL x900cc;3949;0;0;0;0
103;ACEITE NATURA GIRASOL X5Lt;19299;0;0;0;0
104;ACEITE NATURA GIRASOL x1.5Lt;5999;0;0;0;0
2367;ACEITE NATURA GIRASOL AERO X 120G;3699;0;0;0;0
3913;ACEITE OLIVA SOLERA DE PILAR X500cc;6900;0;0;0;0
3986;ACEITE MOLTO GIRASOL AERO x120cc;3099;0;0;0;0
6054;ACEITE LEGITIMO GIRASOL x900cc;3249;0;0;0;0
7044;ACEITE MAROLIO GIRASOL x900ml;3099;0;0;0;0
8580;ACEITE COCINERO MEZCLA x1.5Lt;4199;0;0;0;0
9083;ACEITE MAROLIO GIRASOL 3LT;9799;0;0;0;0
9085;ACEITE MAROLIO GIRASOL 1.5LT;4999;0;0;0;0
11325;ACEITE COCINERO MEZCLA x900cc;2799;0;0;0;0
20108;ACEITE DOÑA TOTA GIRASOL x4,5LT;9999;0;0;0;0
20109;ACEITE PREMIER GIRASOL x900cc;2279;0;0;0;0
60559;ACEITE DOÑA NORITA GIRASOL X4.5LT;10190;0;0;0;0
460403;ACEITE MAROLIO MEZCLA x900ml;2349;0;0;0;0
460654;ACEITE MAROLIO MEZCLA X1.5LT;3999;0;0;0;0
460667;ACEITE CAÑUELAS GIRASOL X5Lt;17999;0;0;0;0
460958;ACEITE MOLTO GIRASOL x900ml;2999;0;0;0;0
461309;ACEITE COCINERO FRITOLIM VEG X120g;3699;0;0;0;0
461314;ACEITE FRITOLIM MANTECA AERO X120CC;3699;0;0;0;0
462884;ACEITE LEGITIMO GIRASOL x1.5Lt;5349;0;0;0;0
463135;ACEITE COCINERO GIRASOL X5L;18590;0;0;0;0
463321;ACEITE LEGITIMO GIRASOL X3LT;10999;0;0;0;0
463360;ACEITE MOLTO GIRASOL x5Lt;15999;0;0;0;0
464098;ACEITE MOLTO MANTECA AERO x120ml;3099;0;0;0;0
465349;ACEITE REINO OLI/GIR x500ml;2749;0;0;0;0
465500;ACEITE ARECO OLIVA x500ml;9999;0;0;0;0
466772;ACEITE ARAUCO OLIVA X2Lt;8999;0;0;0;0
466790;ACEITE DE OLIVA EXTRA V LODE x500cc;8999;0;0;0;0
469485;ACEITE LOPEZ OLIVA E/VIRGEN X500ml;14999;0;0;0;0
471879;ACEITE VILLA MAZAN OLIVA VIDRIO X 500ML;5999;0;0;0;0
472911;ACEITE SIGLO DE ORO MEZCLA x900cc;2399;0;0;0;0
474330;ACEITE ARECO OLIVA LATA x500ml;10990;0;0;0;0
476287;ACEITE ESMERALDA OLIVA x5Lt;31599;0;0;0;0
476288;ACEITE ESMERALDA OLIVA x500cc;3999;0;0;0;0
478957;ACEITE GIRA-SOL GIRASOL X4.5L;9999;0;0;0;10290
479767;ACEITE NANOSOL GIRASOL X900ML;2299;0;0;0;0
480841;ACEITE GIRASOL GRISOL x900cc;2299;0;0;0;0
480905;ROCIO VEGETAL OLIVA CAÑUELAS x150g;4999;0;0;0;0
17;ARROZ DOS HERMANOS L.F X 1KG;999;0;0;0;939
18;ARROZ DOS HERMANOS L.F X500g;579;0;0;0;529
21;ARROZ DOS HERMANOS PARB x1kg;1199;0;0;0;1099
22;ARROZ DOS HERMANOS PARB 5KG;5999;0;0;0;5249
23;ARROZ DOS HERMANOS P/AMA X500g;579;0;0;0;625
309;ARROZ MAROLIO L.F 500G;689;0;0;0;0
310;ARROZ MOLINOS ALA L.F X 1KG;1259;0;0;0;0
311;ARROZ MOLINOS ALA L.F x500g;719;0;0;0;0
312;ARROZ MONEDA L.F x1kg;999;0;0;0;0
313;ARROZ MONEDA L.F X500g;599;0;0;0;0
4072;ARROZ GALLO ORO PARBO X 500G;999;0;0;0;0
4188;ARROZ MOLTO DOBLE X 1KG;1999;0;0;0;0
4298;ARROZ DOS HERMANOS G/L 5KG;4999;0;0;0;4950
6410;ARROZ AMANDA L.F x500gr;849;0;0;0;0
7415;ARROZ MOLTO L.F X 1KG;1299;0;0;0;0
9723;ARROZ MOLTO PARBOLIZADO X 1KG;1999;0;0;0;0
9724;ARROZ MOLTO PARBOLIZADO X 500G;999;0;0;0;0
9725;ARROZ MOLTO INTEGRAL X 500G;699;0;0;0;0
10520;ARROZ MOLTO DOBLE CAROLINA X 500G;1099;0;0;0;0
10819;ARROZ MOLTO INTEGRAL X 1KG;1299;0;0;0;0
11167;ARROZ CAPILLA 0000 BSA x1Kg (PAQ.VERDE);899;0;0;0;899
13812;ARROZ SUELTO x KILO;799;0;0;0;0
460315;ARROZ MOLTO L.F 500G;699;0;0;0;0
460974;ARROZ MAROLIO DOBLE 1KG;1999;0;0;0;0
460987;ARROZ MAROLIO L.F x1kg;1199;0;0;0;0
462865;ARROZ CAROGRAN L.F 00000 X 1KG;949;0;0;0;999
462866;ARROZ CAROGRAN L.F 0000 x500g;519;0;0;0;0
462867;ARROZ CAROGRAN PUL.00000 500G;549;0;0;0;0
462868;ARROZ CAROGRAN 0000 L.F x1kg;949;0;0;0;0
462931;ARROZ MOLTO L.F X 5KG;6999;0;0;0;0
464200;ARROZ MAROLIO PARBOLIZADO X500G;999;0;0;0;0
464201;ARROZ MAROLIO PARBOLIZADO X 1KG;1899;0;0;0;0
464947;ARROZ PARBOLIZADO SUELTO TUCU;999;0;0;0;0
467316;ARROZ EL DIQUE L.F X 500G;499;0;0;0;0
467317;ARROZ EL DIQUE L.F X 1KG;1049;0;0;0;0
473106;ARROZ MARIA BLANCO L.F 1KG;1299;0;0;0;0
473211;ARROZ MARIA L.F 500G;699;0;0;0;869
474490;ARROZ MAROLIO DOBL CAROL 500G;999;0;0;0;0
476446;ARROZ DULCINEA L.F X500G;449;0;0;0;0
476605;ARROZ GALLO PARBO X1 KG;1890;0;0;0;0
478258;ARROZ VINCHA DE ORO L.F PAQ X1KG;899;0;0;0;0
478259;ARROZ MOCOVI DOBLE CAR EST x1kg;1399;0;0;0;0
478285;ARROZ MOCOVI L.F PAQ X500g;539;0;0;0;0
478286;ARROZ MOCOVI L.F ESTUCHE x500gr;559;0;0;0;0
478287;ARROZ MOCOVI L.F ESTUCHE x1kg;999;0;0;0;0
478288;ARROZ MOCOVI DOBLE CAR EST x500gr;699;0;0;0;0
478289;ARROZ MOCOVI DOBLE CAR PAQ x1kg;1399;0;0;0;0
478290;ARROZ MOCOVI DOBLE CAR PAQ x500gr;699;0;0;0;0
478291;ARROZ VINCHA DE ORO L.F X500G;449;0;0;0;0
478533;ARROZ CAROGRAN INTEGRAL 00000 x1Kg;999;0;0;0;0
1;FIDEO LUCCHETTI x500g PENNE RIGA;1099;0;0;0;1099
1366;FIDEO CHIETI MOÑO/NIDO X500g;1249;0;0;0;0
1370;FIDEO DON VICENTE CASER 500G;2599;0;0;0;0
1371;FIDEO DON VICENTE FETUCC 500G;2599;0;0;0;0
1372;FIDEO DON VICENTE TALL 500G;2599;0;0;0;0
1375;FIDEO PROVIDENCIA X500g DEDALITO;699;0;0;0;0
1376;FIDEO PROVIDENCIA X500g MOSTACHOL;759;0;0;0;0
1377;FIDEO PROVIDENCIA MOÑO X500g;1049;0;0;0;0
1379;FIDEO PROVIDENCIA X500g RIGATTI;759;0;0;0;0
1380;FIDEO PROVIDENCIA X500g SPAGHETTI;699;0;0;0;0
1381;FIDEO PROVIDENCIA X500g TALLARIN;699;0;0;0;0
1382;FIDEO PROVIDENCIA X500g TIRABUZON;759;0;0;0;0
1389;FIDEO LUCCHETTI X500G TALLARIN;1099;0;0;0;1099
1392;FIDEO LUCCHETTI x500g CODITO;1099;0;0;0;1099
1393;FIDEO LUCCHETTI x500g DEDALITO;1099;0;0;0;1099
1395;FIDEO LUCCHETTI LETRITAS X500GR;1099;0;0;0;0
1396;FIDEO LUCCHETTI x500g MOSTACHOL;1099;0;0;0;1099
1397;FIDEO LUCCHETTI X500G SPAGHETTI;1099;0;0;0;0
1398;FIDEO LUCCHETTI x500g TIRABUZON;1099;0;0;0;1099
1400;FIDEO MATARAZZO VARIOS X500g;1249;0;0;0;0
1402;FIDEO MATARAZZO DEDALIT 500G;1099;0;0;0;0
1404;FIDEO MATARAZZO x500g MOSTACHOL;1349;0;0;0;1299
1405;FIDEO MATARAZZO x500g RIGATTE;1349;0;0;0;0
1406;FIDEO MATARAZZO x500g SPAGHETTI;1349;0;0;0;1299
1407;FIDEO MATARAZZO x500g TALLARIN;1349;0;0;0;1299
1408;FIDEO MATARAZZO x500g TIRABUZON;1349;0;0;0;0
1409;FIDEO MOLTO X500g CELENTANO;849;0;0;0;0
1410;FIDEO MOLTO X500g CODO;849;0;0;0;0
1411;FIDEO MOLTO X500g DEDALITO;849;0;0;0;0
1412;FIDEO MATARAZZO x500g FORATTI;1149;0;0;0;0
1413;FIDEO MOLTO X500g MOST RAYAD;849;0;0;0;0
1414;FIDEO MOLTO MOÑO X500g;1399;0;0;0;0
1415;FIDEO MOLTO X500g RIGATTI;849;0;0;0;0
1416;FIDEO MOLTO X500g SPAGHETTI;849;0;0;0;0
1417;FIDEO MOLTO X500g TALLARIN;849;0;0;0;0
1418;FIDEO MOLTO X500g TIRABUZON;849;0;0;0;0
3538;FIDEO SAN AGUSTIN ÑOQUIS X500G;599;0;0;0;0
3539;FIDEO SAN AGUSTIN RIGATTI 500G;599;0;0;0;0
3540;FIDEO SAN AGUSTIN MOSTAC 500GR;599;0;0;0;0
3541;FIDEO SAN AGUSTIN TIRAB 500G;599;0;0;0;0
3542;FIDEO SAN AGUSTIN NIDO ANGOST. 500G;849;0;0;0;0
3543;FIDEO SAN AGUSTIN AVE MARIA 500G;599;0;0;0;0
4835;FIDEO SANTA ISABEL X500g CODITO;599;0;0;0;0
5011;FIDEO PROVIDENCIA NIDO X500g TAGLIATELL;1049;0;0;0;0
5012;FIDEO PROVIDENCIA NIDO X500g SPAGHETTI;1049;0;0;0;0
5229;FIDEO MATARAZZO FETUCCINI X500GR;1599;0;0;0;0
5369;FIDEO NANDO NIDO/MOÑO X500g;1049;0;0;0;0
5712;FIDEO MOLTO DOBLADITOS HUEVO X500g;1699;0;0;0;0
5713;FIDEO MOLTO TIRABUZON HUEVO 500G;999;0;0;0;0
5724;FIDEO PROVIDENCIA NIDO X500g CAB. ANGEL;1049;0;0;0;0
6729;FIDEO MOLTO X500g AVE MARIA;849;0;0;0;0
6786;FIDEO PROVIDENCIA X500g PAMPERITO;759;0;0;0;0
6788;FIDEO PROVIDENCIA X500g PAMPERO;759;0;0;0;0
6809;FIDEO MOLTO X500g DEDALON;849;0;0;0;0
6816;FIDEO MOLTO X500g MOST. LISO;849;0;0;0;0
6817;FIDEO MOLTO X500g CODITO;849;0;0;0;0
6818;FIDEO MOLTO X500g DEDALES;849;0;0;0;0
7050;FIDEO MOLTO X500g CAB. ANGEL;849;0;0;0;0
7532;FIDEO LUCCHETTI MUNICION X500GR;1099;0;0;0;0
7548;FIDEO MOLTO X500g CANUTO;849;0;0;0;0
7552;FIDEO DON VICENTE TIRABUZON X500g;2499;0;0;0;0
7708;FIDEO BUEN GUSTO PREM TALL 500G;1049;0;0;0;0
7934;FIDEO SAN AGUSTIN NIDO ANCH 500GR;849;0;0;0;0
8106;FIDEO MOLTO NIDO SPAG X500g;1499;0;0;0;0
8107;FIDEO MOLTO NIDO TAGLIAT X500g;1499;0;0;0;0
8131;FIDEO PROVIDENCIA TIRABUZON X 5KG;6999;0;0;0;0
8133;FIDEO PROVIDENCIA LARGO/GUISO X5Kg;6999;0;0;0;0
8705;FIDEO MOLTO X500g CAB. ANGEL;849;0;0;0;0
8875;FIDEO NANDO NIDO/MOÑO X2Kg;3599;0;0;0;0
9013;CAPELETTINI GIACOMO x500g TRIDICCI;3999;0;0;0;4969
9014;CAPELETTINI GIACOMO x500g VERDURA;3999;0;0;0;4969
9015;CAPELETTINI GIACOMO x500g CARNE;3999;0;0;0;4969
9016;CAPELETTINI GIACOMO x500g QUESO Y JA;3999;0;0;0;4969
9312;FIDEO MAROLIO x500g CODO;699;0;0;0;0
9805;FIDEO MAROLIO x500g MOST. RAYA;699;0;0;0;0
9807;FIDEO MAROLIO x500g TIRABUZON;699;0;0;0;0
9808;FIDEO MAROLIO x500g TALLARINES;699;0;0;0;0
9809;FIDEO MAROLIO x500g SPAGHETTI;699;0;0;0;0
10193;FIDEO MAROLIO x500g RIGATTI;699;0;0;0;0
11694;FIDEO SUELTO ESPECIAL xkg;1890;0;0;0;0
13729;FIDEOS LARGOS SUELTOS xKG;1199;0;0;0;0
13826;FIDEO GUISERO SUELTO X KILO;1199;0;0;0;0
13828;FIDEO MOÑO/ESPECIAL SUELTO X KILO;1490;0;0;0;0
14334;FIDEO/ARROZ/POLENTA P/ANIMALES X KG;999;0;0;0;0
20012;FIDEO RIVOLI x500g FUSILLIS;959;0;0;0;0
78543;FIDEO SUELTO P/ANIMALES XKG;900;0;0;0;0
460978;FIDEO MAROLIO x500g DEDALITO;699;0;0;0;0
460981;FIDEO MAROLIO x500g FORATTI;699;0;0;0;0
460989;FIDEO MAROLIO x500g CELENTANO;699;0;0;0;0
461147;FIDEO MAROLIO x500g MUNICION;699;0;0;0;0
461191;FIDEO MAROLIO x500g CODITO;699;0;0;0;0
461192;FIDEO MAROLIO x500g CARACOL;699;0;0;0;0
461193;FIDEO MAROLIO x500g CANUTO;699;0;0;0;0
461641;FIDEO PROVIDENCIA X500g TAGLIATELL;699;0;0;0;0
462532;FIDEO MAROLIO x500g MOST. LISO;699;0;0;0;0
462533;FIDEO MAROLIO x500g DEDALES;699;0;0;0;0
462534;FIDEO MAROLIO x500g CAB. ANGEL;699;0;0;0;0
462535;FIDEO MAROLIO x500g RIGATTON;699;0;0;0;0
462759;FIDEO PROVIDENCIA X500g MUNICION;699;0;0;0;0
464070;FIDEO PROVIDENCIA X500g CODO;759;0;0;0;0
465073;FIDEO DON BERNABEU TALLARIN X500GR;549;0;0;0;0
466725;FIDEO MOLTO X500g BAVETTE;849;0;0;0;0
467484;FIDEO MAROLIO x500g BAVETTE;699;0;0;0;0
468144;CAPELETTINI GIACOMO x250g VERDURA;2069;0;0;0;2311
468678;FIDEO RIVOLI ESPECIAL X5KG;12990;0;0;0;0
468679;FIDEO RIVOLI GUISERO X5Kg;8890;0;0;0;0
468683;FIDEO CHICAGO ESPECIAL X500g;1290;0;0;0;0
468849;FIDEO MAROLIO TALLARIN ESP. X500g;1549;0;0;0;0
470551;FIDEO LUCCHETTI x500g AVE MARIA;1099;0;0;0;1099
472058;FIDEO MOLTO X500g CARACOLES;849;0;0;0;0
472065;FIDEO MATARAZZO x500g CODITO;1349;0;0;0;1299
472145;FIDEO MAROLIO x500g AVE MARIA;699;0;0;0;0
472146;FIDEO MAROLIO x500g DEDALON;699;0;0;0;0
472455;FIDEO SOL PAMPEANO MOÑOS X500G;1099;0;0;0;0
472595;FIDEO MATARAZZO x500g AVE MARIA;1349;0;0;0;1299
473118;LASAGNA SOL PAMPEANO x200g;1399;0;0;0;0
474165;FIDEO MOLTO INTEGRAL TIRABUZON x500gr;999;0;0;0;0
474479;FIDEO MOLTO X500g FORATTI;979;0;0;0;0
474642;FIDEO SANTA ISABEL X500g CODO;679;0;0;0;0
474644;FIDEO SANTA ISABEL X500g TIRABUZON;599;0;0;0;0
474645;FIDEO SANTA ISABEL X500g CARACOL;599;0;0;0;0
474647;FIDEO SANTA ISABEL X500GR TALLARIN;549;0;0;0;0
474648;FIDEO SANTA ISABEL X500GR SPAGHETTI;549;0;0;0;0
474654;FIDEO SANTA ISABEL x500g BAVETTE;679;0;0;0;0
474771;FIDEO LUCCHETTI x500g RIGATTI;1099;0;0;0;1099
474891;FIDEO SANTA ISABEL X500g RIGATTI;599;0;0;0;0
474893;FIDEO SANTA ISABEL X500g MOSTACHOL;599;0;0;0;0
474992;FIDEO LUCCHETTI HUEV TIRAB 500G;1499;0;0;0;0
475402;FIDEO SOL PAMPEANO x500g RIGATTI;749;0;0;0;0
475403;FIDEO SOL PAMPEANO x500g MOST RAYAD;749;0;0;0;0
475404;FIDEO SOL PAMPEANO x500g TIRABUZON;749;0;0;0;0
475405;FIDEO SOL PAMPEANO x500g AVE MARIA;749;0;0;0;0
475406;FIDEO SOL PAMPEANO x500g CELENTANO;749;0;0;0;0
475407;FIDEO SOL PAMPEANO x500g TALLARIN;749;0;0;0;0
475408;FIDEO SOL PAMPEANO VEGETAL x500g MOST RAYAD;1019;0;0;0;0
475409;FIDEO SOL PAMPEANO VEGETAL x500g TIRABUZON;1019;0;0;0;0
475410;FIDEO CHICAGO x500g LARGOS;899;0;0;0;0
475411;FIDEO CHICAGO x500g GUISEROS;899;0;0;0;0
475412;FIDEO CHICAGO x500g SOPEROS;899;0;0;0;0
475413;FIDEO RIVOLI x500g TALLARIN;959;0;0;0;0
475414;FIDEO RIVOLI x500g ENTREFINO;959;0;0;0;0
475415;FIDEO RIVOLI x500g ÑOQUIS;959;0;0;0;0
475416;FIDEO RIVOLI x500g DEDALES;959;0;0;0;0
475417;FIDEO RIVOLI x500g CODITO;959;0;0;0;0
475418;FIDEO RIVOLI x500g DEDALITO;959;0;0;0;0
475419;FIDEO RIVOLI x500g CODO;959;0;0;0;0
475420;FIDEO RIVOLI x500g TIRABUZON;959;0;0;0;0
475421;FIDEO RIVOLI x500g PAMPERO;959;0;0;0;0
475422;FIDEO RIVOLI NIDO ROSCA x500g SPAGHETTI;1299;0;0;0;0
475423;FIDEO RIVOLI NIDO ROSCA x500g TALLARIN;1390;0;0;0;0
475424;FIDEO RIVOLI NIDO ROSCA x500g CINTA;1390;0;0;0;0
475435;FIDEO SOL PAMPEANO x500g DEDALITOS;749;0;0;0;0
475436;FIDEO SOL PAMPEANO x500g DEDAL;749;0;0;0;0
475499;FIDEO SOL PAMPEANO x500g CODITOS;749;0;0;0;0
475500;FIDEO SOL PAMPEANO x500g SPAGUETTIS;749;0;0;0;0
475555;FIDEO LUCCHETTI x500g FORATTI;1099;0;0;0;1099
475809;FIDEO SOL PAMPEANO x500g CORNETIN;749;0;0;0;0
475810;FIDEO SOL PAMPEANO x500g CODOS;749;0;0;0;0
475811;FIDEO SOL PAMPEANO x500g MOSTACHOL;749;0;0;0;0
475840;FIDEO SAN AGUSTIN PAMPERITOS 500G;599;0;0;0;0
475844;FIDEO SAN AGUSTIN MUNICIONES 500G;599;0;0;0;0
476029;FIDEO RIVOLI x500g PUNTITAS;959;0;0;0;0
476030;FIDEO RIVOLI x500g PAMPERITO;959;0;0;0;0
476031;FIDEO RIVOLI x500g TIRAB.VEG;959;0;0;0;0
476386;FIDEO PROVIDENCIA NIDO CAB.ANGEL x5Kg;8136;0;0;0;0
476387;FIDEO PROVIDENCIA NIDO TAGLIA X5kg;8136;0;0;0;0
476491;FIDEO NIDO HUEVO N2 EL RECORD X500g;1299;0;0;0;0
477230;FIDEO BONAVITA CARACOLES X500G;759;0;0;0;0
477233;FIDEO BONAVITA TIRBUZON 500GR;759;0;0;0;0
477385;FIDEO MOLTO MOSTACHOL HUEVO x500gr;999;0;0;0;0
477386;FIDEO MOLTO TALLARIN HUEVO x500gr;999;0;0;0;0
477387;FIDEO MOLTO SPAGHETTI HUEVO x500gr;999;0;0;0;0
477614;FIDEO BONAVITA MOST.RAYADO x500gr;699;0;0;0;0
477694;FIDEO CELESTIAL x500g TALLARIN;669;0;0;0;0
477817;FIDEO PROVIDENCIA X500g CAB. ANGEL;759;0;0;0;0
477886;FIDEO RIVOLI 500G MOÑO MED.;1190;0;0;0;0
477888;FIDEO RIVOLI x500g MOSTACHOL;959;0;0;0;0
478206;FIDEO DONACI RIGATTI X 500G.;599;0;0;0;0
478497;FIDEO ALDENTE GUISERO X500GR;499;0;0;0;0
479109;FIDEO SOL PAMPEANO CABELLITO x500g;1019;0;0;0;0
479171;FIDEO SOL PAMPEANO x500g FORATTI;829;0;0;0;0
479262;FIDEO FAVORITA X500GR DEDALITO;799;0;0;0;0
479263;FIDEO FAVORITA X500GR MOSTACHOL;799;0;0;0;0
479264;FIDEO FAVORITA X500GR TIRABUZON;799;0;0;0;0
479265;FIDEO FAVORITA X500GR CODITOS;799;0;0;0;0
479266;FIDEO FAVORITA LARGOS X500GR TALLARIN;799;0;0;0;0
479267;FIDEO FAVORITA LARGOS X500GR SPAGHETTI;799;0;0;0;0
479393;FIDEO DON BERNABEU TIRABUZON X500GR;549;0;0;0;0
479395;FIDEO DON BERNABEU MOSTACHOL X500GR;549;0;0;0;0
479396;FIDEO DON BERNABEU RIGATTI X500GR;549;0;0;0;0
479397;FIDEO DON BERNABEU CODITO X500GR;549;0;0;0;0
479398;FIDEO DON BERNABEU SPAGHETTI X500GR;549;0;0;0;0
479526;FIDEO DONACI TIRABUZON X500GR;599;0;0;0;0
479749;FIDEO DON VICENTE RIGATTI X500GR;2599;0;0;0;0
480099;FID ARCOR TIRABUZON x500g;899;0;0;0;0
480100;FID ARCOR CODITO x500g;799;0;0;0;0
480101;FIDEO ARCOR SPAGHETTI X500GR;899;0;0;0;0
480169;FIDEOS MOLTO INTEGRAL TALLARIN x500g;759;0;0;0;0
480400;FIDEOS MATARAZZO P.RIGATE 3VEG x500g;1799;0;0;0;0
480672;FID MATARAZZO BUCATTINI x500g;1249;0;0;0;0
692;TOMATE TRIT. CAPILLA MENDOCINA X950g;1469;0;0;0;1399
1556;TOMATE ENTERO MAROLIO LATA X400G;949;0;0;0;0
1885;TOMATE PERITA MOLTO ENTERO X400g;949;0;0;0;799
2834;PULPA DE TOMATE MAROLIO X520G;649;0;0;0;0
2835;PULPA DE TOMATE MOLTO X520G;649;0;0;0;0
2843;PURE DE TOMATE LA HUERTA X520g;899;0;0;0;0
2849;PURE DE TOMATE MAROLIO X520g;649;0;0;0;0
2850;PURE DE TOMATE MOLTO X520g;649;0;0;0;539
2851;PURE DE TOMATE SABORES DEL VALLE X 520GRS;649;0;0;0;0
3378;TOMATE TRIT. SABORES DEL VALLE X950g;1449;0;0;0;0
4374;PURE DE TOMATE MORA X 520;659;0;0;0;0
5102;TOMATE TRIT. SABORES DEL VALLE TTB 500GR;699;0;0;0;0
7414;TOMATE TRIT. CIALPIL DP X970g;1399;0;0;0;0
9138;PURE DE TOMATE MOLTO X340g;629;0;0;0;0
9759;TOMATE ENTERO COLINA 400G;949;0;0;0;0
12323;TOMATE PERITA SANTA ISABEL X400g;899;0;0;0;0
444445;TOMATE TRIT. MOLTO X950G;2204;0;0;0;0
460982;TOMATE TRIT. MAROLIO TTB X500g;1237;0;0;0;0
460990;TOMATE CUBETEADO MAROLIO 400G;944;0;0;0;0
462933;PURE DE TOMATE CONCIENCIA X520g;629;0;0;0;0
463719;TOMATE CUBETEADO MOLTO X400g;949;0;0;0;0
463906;TOMATE TRIT. MAROLIO X910GR;2151;0;0;0;0
469491;TOMATE TRIT. HORVINDUL LATA X8KG;7349;0;0;0;0
470672;PURE DE TOMATE NOEL x520GRS;733;0;0;0;0
470844;TOMATE PERITA ALCO x400gr;944;0;0;0;1249
470845;TOMATE CUBETEADO ALCO 400G;944;0;0;0;0
473942;PURE DE TOMATE 7 DIAS X210g;399;0;0;0;0
474556;PURE DE TOMATE BIG C x210g;399;0;0;0;0
474557;PURE DE TOMATE BIG C x1040g;1199;0;0;0;0
475246;TOMATE TRIT. GALLARDO x950gr;1364;0;0;0;0
475375;PURE DE TOMATE SANTA ISABEL x520g;619;0;0;0;0
475571;PURE DE TOMATE MONTENEVI TETRA x520g;599;0;0;0;0
475572;PULPA DE TOMATE MONTENEVI TETRA x520g;499;0;0;0;399
477820;PURE DE TOMATE VIGENTE x520g;439;0;0;0;0
477821;TOMATE TRIT. VIGENTE TTB X500g;679;0;0;0;0
477822;PULPA DE TOMATE EL GENOVES x520g;399;0;0;0;0
477979;PURE DE TOMATE INCA x520g;749;0;0;0;0
478006;TOMATE ENTERO SILVIA X400G;949;0;0;0;0
478262;TOMATE PERITA VIGENTE LATA X400g;860;0;0;0;0
478673;PURE DE TOMATE SABORES DEL VALLE x1Lt;1048;0;0;0;0
479054;TOMATE TRIT. VIGENTE TTB x340g;349;0;0;0;0
479761;TOMATE TRITURADO CHIRO x950g;1574;0;0;0;0
481122;CAPILLA MENDOCINA TOMATE PERITA LATAx400g;859;0;0;0;0
1891;SALSA D/TOM KNORR LISTA FILETT X340g;628;0;0;0;0
1894;SALSA D/TOM KNORR LISTA POMAROLA X340g;628;0;0;0;0
3776;SALSA D/TOM MOLTO TTB FILETTO X340g;786;0;0;0;0
3777;SALSA D/TOM MOLTO TTB POMAROLA X340g;786;0;0;0;0
3814;SALSA D/TOM MOLTO PIZZA TTB X340g;786;0;0;0;0
4622;SALSA D/TOM KNORR LISTA X340g PIZZA;1048;0;0;0;0
9040;SALSA D/TOM NOEL LISTA PIZZA X340g;944;0;0;0;0
9041;SALSA D/TOM NOEL PORTUGUESA X340g;944;0;0;0;0
9042;SALSA D/TOM NOEL POMAROLA X340g;944;0;0;0;0
10587;SALSA D/TOM KNORR LISTA PIZZA X200g;829;0;0;0;0
461015;SALSA D/TOM MOLTO TTB PORTUG X340g;786;0;0;0;0
461149;SALSA CHIMICHURRI MAROLIO x285g;943;0;0;0;0
461738;SALSA AJI PICANTE MAROLIO x295gr;1258;0;0;0;0
462946;SALSA D/TOM CICA LISTA X340g PIZZA;943;0;0;0;990
462947;SALSA D/TOM CICA LISTA X340g FILETTO;943;0;0;0;990
464909;SALSA D/TOM CICA LISTA X340g POMAROLA;943;0;0;0;990
464913;SALSA D/TOM CICA LISTA X340g PORTUGUESA;943;0;0;0;990
465862;SALSA D/TOM CICA LISTA X340g TUCO;943;0;0;0;990
469735;SALSA LA PARMESANA FRUTILLA x290g;1784;0;0;0;0
469942;SALSA E/TOM MAROLIO POMAROLA X200g;629;0;0;0;0
469943;SALSA MAROLIO PIZZA x200g;629;0;0;0;0
470834;SALSA LA PARMESANA CARAMELO x330g;1784;0;0;0;0
470835;SALSA LA PARMESANA REDUC.SOJA x300ml;2099;0;0;0;0
474979;SALSA PARRILLERA AROMAS Y SAB X 250;1049;0;0;0;0
477108;SALSA D/TOM ALCO LISTA DP POMAROLA X340g;839;0;0;0;0
477109;SALSA D/TOM ALCO LISTA DP PORTUG X340g;839;0;0;0;0
477110;SALSA D/TOM ALCO LISTA DP NAPOLIT X340g;839;0;0;0;0
477111;SALSA D/TOM ALCO LISTA DP PIZZA X340g;839;0;0;0;0
477366;SALSA CESAR CASALTA x285g;2834;0;0;0;0
477367;CHIMICHURRI CASALTA x300g;2414;0;0;0;0
477368;SALSA BARBACOA CASALTA x335g;3149;0;0;0;0
477369;CHIMICHURRI AHUMADO CASALTA x300g;2624;0;0;0;0
477370;SALSA BARBACOA AHUMADO CASALTA x335g;3149;0;0;0;0
478014;SALSA D/TOM ALCO LISTA DP TUCO X340g;839;0;0;0;0
478303;SALSA POMAROLA LA CAMPAGNOLA DP x340gr;1154;0;0;0;0
478318;SALSA D/TOM ALCO LISTA DP FILETTO X340g;839;0;0;0;0
479490;SALSA HERDEZ CASERA x240g;3989;0;0;0;0
479491;SALSA HERDEZ VERDE x240g;3989;0;0;0;0
479492;SALSA HERDEZ TAQUERA x240g;3989;0;0;0;0
479493;SALSA HERDEZ CHIPOTLE PIC. CREMOSO x240g;5499;0;0;0;0
479494;SALSA HERDEZ HABANERO HOT SAUCE x142g;5499;0;0;0;0
479997;MAYONESA C/HABANERO HERDEZ x305g;5144;0;0;0;0
480673;SALSA CANALE DP POMAROLA x340g;899;0;0;0;0
480674;SALSA CANALE DP PORTUGUESA x340gr;899;0;0;0;0
480675;SALSA CANALE DP NAPOLITANA x340g;899;0;0;0;0
480676;SALSA CANALE DP PIZZA x340g;899;0;0;0;0
480677;SALSA CANALE DP FILETTO x340g;899;0;0;0;0
480678;SALSA CANALE DP TUCO x340g;899;0;0;0;0
2917;EXTRACTO DE TOMATE INCA DOBLE X 150GRS;766;0;0;0;0
465784;EXTRACTO DE TOMATE MAROLIO x200g;579;0;0;0;0
465786;EXTRACTO DE TOMATE MOLTO 200G;839;0;0;0;0
479052;EXTRACTO DE TOMATE VIGENTE DOB 150GR;943;0;0;0;0
352;AZUCAR LEDESMA x1kg;1399;0;0;0;0
355;AZUCAR CHANGO x1KG;1299;0;0;0;999
357;AZUCAR HILERET LIGHT x250grs;1149;0;0;0;0
796;AZUCAR IMPALPABLE CENTURION x200g;569;0;0;0;0
1187;AZUCAR HILERET LIGHT x500gr;1799;0;0;0;0
7128;AZUCAR RAVANA IMPALPABLE x500g;1999;0;0;0;0
9812;AZUCAR MAROLIO x1kg;1159;0;0;0;0
9875;AZUCAR IMPALPABLE EMETH x250g;689;0;0;0;0
10585;AZUCAR TUCUMAN x1kg;999;0;0;0;0
13810;AZUCAR SUELTA x KILO;949;0;0;0;0
14158;AZUCAR SUELTA LEDESMA xKILO;1190;0;0;0;0
460409;AZUCAR SUELTA LEDESMA;2746;0;0;0;0
464475;AZUCAR LEDESMA LIGHT x500g;1399;0;0;0;0
465780;AZUCAR SAN JOAQUIN x50Kg;46990;0;0;0;44990
466803;AZUCAR IMPALPABLE AROMAS/SABORES x 200gr;1175;0;0;0;0
467268;AZUCAR EQUALSWEET LIGHT x500g;714;0;0;0;0
467980;AZUCAR VALLE/IVANA REFINADA x1kg;1099;0;0;0;999
468943;AZUCAR LEDESMA RUBIO MASCABO x800gr;1449;0;0;0;0
471561;AZUCAR CHANGO C/STEVIA x500g;1399;0;0;0;0
474422;AZUCAR ESPECIAL SUELTA xKg;2695;0;0;0;0
476729;AZUCAR IMPALPABLE EMETH x1Kg;2729;0;0;0;0
476735;SERVICIO DE FRACCIONADO;4500;0;0;0;0
477215;AZUCAR BARRIDO TUCUMAN x50Kg;16250;0;0;0;0
477790;AZUCAR COMUN LA MUÑECA/SAN VICENTE X 1KG;749;0;0;0;0
478461;AZUCAR IMPALPABLE SABOR SUR x200gr;2269;0;0;0;0
478493;AZUCAR COMUN PROVIDENCIA/DIAMANTE x1Kg;999;0;0;0;0
479578;AZUCAR EL MARQUES x1Kg;999;0;0;0;0
1183;EDULC. CHUKER 400ML;2728;0;0;0;0
1184;EDULC. EQUAL SWEET 400SOB;5984;0;0;0;0
1185;EDULC. HILERET 1A10 500SOB;8999;0;0;0;0
1186;EDULC. HILERET 1A10 500ML;3499;0;0;0;0
1188;EDULC. HILERET SWEET LIQ x400ml;3099;0;0;0;0
1190;EDULC. HILERET SWEET 400SOB;7349;0;0;0;0
1191;EDULC. SI DIET LIQ 250ML;1510;0;0;0;0
1192;EDULC. SI DIET LIQ x500ml;2624;0;0;0;0
1193;EDULC. SI DIET LIQ 200ML;1259;0;0;0;0
1194;EDULC. TUY SUCRA 50SOB;1529;0;0;0;0
1740;EDULC. HILERET 1A10 100SOB;1889;0;0;0;1499
1763;EDULC. EQUAL SWEET 50SOB;1049;0;0;0;0
4994;EDULC. HILERET 1A10 LIQ 250ML;1799;0;0;0;0
5227;EDULC. HILERET STEV 50SOB;1679;0;0;0;0
5260;EDULC. HILERET ZUCRA x200ml;2299;0;0;0;0
5361;EDULC. HILERET STEV 100SOB;2098;0;0;0;0
5746;EDULC. HILERET SWEET 100SOB;2099;0;0;0;0
6069;EDULC. HILERET 1A10 50SOB;1049;0;0;0;0
6251;EDULC. CHUKER 200ML;1993;0;0;0;0
6254;EDULC. SUCARYL LIQ 360ML;2519;0;0;0;0
6255;EDULC. SUCARYL LIQ 180ML;1679;0;0;0;0
6538;EDUL HILERET SUELTO X25u;523;0;0;0;0
7407;EDULC. EQUAL SWEET 100SOB;1784;0;0;0;0
7697;EDULC. EQUAL SWEET SUC 50SOB;1259;0;0;0;0
7701;EDULC. EQUAL SWEET STEV 100SOB;2834;0;0;0;0
8297;EDULC. HILERET SWEET LIQ x200ml;1949;0;0;0;0
9062;EDULC. EQUAL SWEET TUY 100SOB;2098;0;0;0;4014
9513;EDULC. SUCARYL SUC. 100SOB;1738;0;0;0;0
9542;EDULC. TUY SWEET 200SOB;3674;0;0;0;3999
9543;EDULC. SWEET TUY 50SOB;1207;0;0;0;1239
9545;EDULC. TUY SUCRA . 200SOB;4199;0;0;0;4417
9546;EDULC. TUY LIQ 400ML;3148;0;0;0;3239
9547;EDULC. TUY LIQ 200ML;1974;0;0;0;0
9987;EDULC. SUCARYL D/MES 50SOB;944;0;0;0;0
9988;EDULC. EQUAL SWEET SUCRA  100 sobr.;2729;0;0;0;0
10968;EDULC. SUCARYL 200SOB;5657;0;0;0;0
10969;EDULC. SUCARYL CLAS 100SOB;2098;0;0;0;0
12155;EDULC. LEDESMA SUCRALOSA x400sob;5239;0;0;0;0
12217;EDULC. TUY CLAS 100SOB;2342;0;0;0;0
460278;EDULC. EQUAL SWEET STEV 50SOB;1259;0;0;0;0
460366;EDULC. SUCARYL SUCRAL. 50SOB;1533;0;0;0;0
460923;EDULC. EQUAL SWEET 200SOB;3149;0;0;0;0
461061;EDULC. HILERET ZUCRA x400ml;3799;0;0;0;0
461120;EDULCORANTE HILERET STEVIA X200;3499;0;0;0;0
463260;EDULC. EQUAL SWEET SUC. 400SOB;4199;0;0;0;0
463980;EDULC. CHUKER STEV 200ML;1999;0;0;0;0
463981;EDULC. CHUKER STEV 400ML;3621;0;0;0;0
464327;EDULC. TUY STEV POLV 50SOB;1574;0;0;0;1699
464410;EDULC. TUY STEV POLV 100SOB;3232;0;0;0;3290
464730;ENDULZ. LEDESMA PVO x50sob;1049;0;0;0;0
465547;EDULC. EL POCILLO SUCRA 180ML;1049;0;0;0;0
466425;ENDULZ. EL POCILLO 180ML;944;0;0;0;0
466426;ENDULZ. LHERITIER BAS AZUC 350G;1364;0;0;0;0
466427;ENDULZ. EL POCILLO STEV 180ML;1679;0;0;0;0
468773;EDULC. TUY CLAS LV 200SOB;3791;0;0;0;0
468774;EDULC. TUY STEV LV 200SOB;5684;0;0;0;0
471672;EDULC. TUY SWEET 200ML;1511;0;0;0;1699
471735;EDULC. SEMPLE LIQ X200ML;1259;0;0;0;0
471736;EDULC. SEMPLE LIQ X400ML;1994;0;0;0;0
471989;EDULC. HILERET LIQ MATE 400ML;3099;0;0;0;0
471990;EDULC. HILERET MATE x200ml;1783;0;0;0;1899
471993;EDULC. HILERET STEVIA F 200 sb;2897;0;0;0;0
471994;EDULC. HILERET CLAS F 200SOB;2371;0;0;0;0
471995;EDULC. HILERET ZUC. F 200SOB;3187;0;0;0;0
471996;EDULC. HILERET ZUC F 100SOB;2028;0;0;0;0
471997;EDULC. HILERET ZUC F 50SOB;1311;0;0;0;0
472649;EDULC. TUY SUCRA LIQ 200ML;1816;0;0;0;1999
472867;EDULC. HILERET SWEET F 200SOB;3883;0;0;0;0
473877;EDULC. SUCARYL TABLETAS x300u;3359;0;0;0;0
474037;EDULC. TUY STEV 200ML;2959;0;0;0;3299
474068;ENDULZ. LEDESMA LIQ SUCR. 200ML;1363;0;0;0;0
474069;ENDULZ. LEDESMA LIQ STEVIA x200ml;2089;0;0;0;0
475891;EDULC. LEDESMA SUCRALOSA x100Un.;1468;0;0;0;0
476544;EDULC. CAÑUELAS CLAS X100SOB;1438;0;0;0;0
476550;EDULC. CAÑUELAS SUCRALOSA X100SOB;2032;0;0;0;0
476715;EDULC. CHUKER C/SUCRALOSA X200ML;1679;0;0;0;0
476730;EDULC. CHUKER SUCRALOSA X400ML;2624;0;0;0;2749
477884;EDULC. TUY MATE 200CC;1974;0;0;0;0
478055;EDULC. HILERET SWEET SUELT 50UN;1049;0;0;0;0
479890;EDULC. CIMES CLASICO X500cc;1994;0;0;0;0
480478;EDULC. CIMES STEVIA X500cc;2204;0;0;0;0
480479;CIMES EDULCORANTE SUCRALOSA x500cc;2414;0;0;0;0
480561;CIMES EDULCORANTE CLASICO x250cc;999;0;0;0;0
480590;HILERET CLASICO x400 SOB;9499;0;0;0;0
480646;EDULCORANTE TUY SUELTOS x200Un.;1199;0;0;0;0
480808;CIMES EDULCORANTE SUCRALOSA x250cc;999;0;0;0;0
480946;EDULC. SUELTO HILERET SWEET x200sob;2999;0;0;0;0
1530;YERBA LA HOJA X500G;1049;0;0;0;0
2780;YERBA PLAYADITO x1Kg;3883;0;0;0;0
3668;YERBA AMANDA TRAD x1Kg;3254;0;0;0;0
3669;YERBA AMANDA TRAD. x500g;1679;0;0;0;0
3671;YERBA CACHAMATE SILUET PLUS x500gr;1468;0;0;0;0
3673;YERBA CACHAMATE SERRANAS x500g;1468;0;0;0;0
3676;YERBA CACHAMATE NARANJA 500g;1468;0;0;0;0
3677;YERBA CACHAMATE 500g AMARILLA;1468;0;0;0;0
3678;YERBA CACHAMATE 500g ROSA;1468;0;0;0;0
3681;YERBA CBSE x500g HIER CUYAN;1679;0;0;0;0
3682;YERBA CBSE x500g LIMON;1679;0;0;0;0
3683;YERBA CBSE x500g MIEL;1679;0;0;0;0
3684;YERBA CBSE x500g NARANJA;1679;0;0;0;0
3685;YERBA CBSE x500g POMELO;1679;0;0;0;0
3686;YERBA CBSE x500g REGULASE;1679;0;0;0;0
3688;YERBA CBSE SERRANA x1Kg;3149;0;0;0;0
3689;YERBA CRUZ MALTA 500g;1783;0;0;0;0
3690;YERBA CRUZ MALTA x1Kg;3149;0;0;0;0
3691;YERBA LA CUMBRECITA x500g;1259;0;0;0;0
3693;YERBA MERCED BARBACUA x500g;4099;0;0;0;0
3694;YERBA MERCED CAM-MONTE x500g;4099;0;0;0;0
3695;YERBA MAROLIO 1KG;2098;0;0;0;0
3696;YERBA MAROLIO 500g;1153;0;0;0;0
3697;YERBA LA MERCED MONTE X500g;3883;0;0;0;0
