9043;AC.SEDAL HIALURONICO x340cc;4199;0;0;0;0
9048;AC.SEDAL BALANCE x340cc;4199;0;0;0;0
9332;SH+AC COMBO PROMO TIO NACHO VARIOS x415;11799;0;0;0;0
9604;AC SEDAL X340ML;4199;0;0;0;0
60646;AC SEDAL DP CERAMIDAS X620ML;5590;0;0;0;0
60648;AC SEDAL BALANCE X620ML;5590;0;0;0;0
461599;AC FRUCTIS VARIOS X200ML;4399;0;0;0;0
462431;AC POLYANA VARIOS X1LT;1499;0;0;0;0
463852;AC PATRICIA ALLEN VARIOS X930ML;1259;0;0;0;0
464058;AC ALGABO VARIOS X930ML;1784;0;0;0;0
466500;AC POLYANA DP x300ml;999;0;0;0;0
466627;AC HEAD&SHOULDERS X300ML;7990;0;0;0;0
467937;SAVIA NATURAL INECTO x200c;2999;0;0;0;0
469399;AC INECTO VARIOS X200ML;2999;0;0;0;0
469587;AC PANTENE X400ML RESTAURAC.;5999;0;0;0;0
469588;AC PANTENE X400ML LISO INFI;5999;0;0;0;0
469590;AC PANTENE X400ML DETOX;5999;0;0;0;0
469616;AC TIO NACHO HERB/MILENARIA X400ML;5249;0;0;0;0
469620;AC TIO NACHO ACLARANTE DP X400ML;5249;0;0;0;0
469621;AC TIO NACHO ENGROSADOR DP X400ML;5249;0;0;0;0
469787;AC ELVIVE X750ML REP. TOTAL;12900;0;0;0;0
469789;AC ELVIVE X750ML KERA LISO;12900;0;0;0;0
469790;AC ELVIVE X750ML KERA BRILL;12900;0;0;0;0
469792;AC ELVIVE X750ML REP. EXTRE;12900;0;0;0;0
469794;AC ELVIVE X750ML 6 OLEOS;12900;0;0;0;0
469795;AC ELVIVE X750ML OLEO COCO;12900;0;0;0;0
469797;AC ELVIVE X750ML ARCILL DET;12900;0;0;0;0
469799;AC ELVIVE X750ML DREAM LONG;12900;0;0;0;0
469801;AC ELVIVE X750ML LONG LISS;12900;0;0;0;0
469846;AC PANTENE X400ML BRILLO;5999;0;0;0;0
471056;CREMA PARA PEINAR ELVIVE x250ml;7873;0;0;0;0
471352;AC TIO NACHO CELULAS MADRE X415ML;7999;0;0;0;0
471390;AC FRUCTIS x300ml;6183;0;0;0;4799
471682;AC SEDAL DP x120ml;734;0;0;0;0
471828;AC VO5 VARIOS X444ML;1574;0;0;0;0
473077;AC TIO NACHO ANTI-DAÑO DP X400ML;5249;0;0;0;0
473401;AC ALGABO 0% S/SAL X750ML;2834;0;0;0;0
473628;AC ALGABO BABY EXT SUAVE X444ML;3254;0;0;0;0
473629;AC ALGABO BABY MANZANILLA X444ML;3254;0;0;0;0
474869;AC PANTENE X200ML FUERZA REC;2999;0;0;0;0
474870;AC PANTENE X200ML HIDRATACIO;2999;0;0;0;0
474871;AC PANTENE X200ML LISO EXTRE;2999;0;0;0;0
474872;AC PANTENE X200ML MICELAR;2999;0;0;0;0
474873;AC PANTENE X200ML RESTAURACI;2999;0;0;0;0
474886;AC PANTENE X200ML RIZOS;2999;0;0;0;0
474916;AC DOVE X400ML RECONSTRUC;6079;0;0;0;0
474918;AC DOVE X400ML NUTRICION;6079;0;0;0;0
474919;AC DOVE X400ML REPARACION;6079;0;0;0;0
474931;AC DOVE X200ML RECONSTRUC;3674;0;0;0;0
474932;AC DOVE X200ML OLEO NUTRI;3674;0;0;0;0
474933;AC DOVE X200ML REGENERACI;3674;0;0;0;0
474939;AC TRESEMME X250ML KERAT FRIZ;4723;0;0;0;0
474940;AC TRESEMME X250ML LISO KERAT;4723;0;0;0;0
474945;AC DOVE X180ML RECONSTRUC;2999;0;0;0;0
474946;AC DOVE X180ML RITUAL REP;2999;0;0;0;0
475355;AC PLUSBELLE ESENCIAL x970ml LARGO SALU;3831;0;0;0;0
475356;AC PLUSBELLE ESENCIAL x970ml RESTAURACI;3831;0;0;0;0
475358;AC PLUSBELLE ESENCIAL x970ml CONT FRIZZ;3831;0;0;0;0
475359;AC PLUSBELLE ESENCIAL x970ml H. INTENSA;3831;0;0;0;0
475456;AC PANTENE X200ML HID EXTREM;2999;0;0;0;0
475461;AC PANTENE DETOX X750ML;8399;0;0;0;0
475488;AC DOVE X200ML RITUAL REP;3674;0;0;0;0
476704;AC PANTENE X400ML REVITALIZ.;5999;0;0;0;0
476706;AC PANTENE X400ML EQUILIBRIO;5999;0;0;0;0
476739;AC DOVE X400ML LARGOS;5790;0;0;0;0
476742;AC DOVE X400ML BRILLO;6079;0;0;0;0
476743;AC DOVE X400ML HIDRATACIO;6079;0;0;0;0
477060;AC TIO NACHO ACLA/ENGR/HERB x200ml;3748;0;0;0;0
477179;AC PANTENE HIDRATA x200cc;3149;0;0;0;0
477181;AC PANTENE DETOX x200cc;3149;0;0;0;0
477330;ACONDICIONADOR KIDS JOHNSONSx200ml.;5249;0;0;0;0
477382;AC ALGABO CONTROL KERATINA x400ml;1574;0;0;0;0
477404;AC PANTENE X200ML BRILLO;2999;0;0;0;0
477462;AC SEDAL X190ML COLAGENO;2834;0;0;0;0
477463;AC SEDAL X190ML ACIDO HIAL;2834;0;0;0;0
477464;AC SEDAL X190ML BOMBA ARGA;2834;0;0;0;0
477465;AC SEDAL X190ML RIZOS DEFI;2834;0;0;0;0
477466;AC SEDAL X190ML BALANCE;2834;0;0;0;0
477467;AC SEDAL X190ML HIALURONIC;2834;0;0;0;0
477468;AC SEDAL X190ML RESTAURAC;2834;0;0;0;0
477469;AC SEDAL X190ML CERAMIDAS;2834;0;0;0;0
477470;AC SEDAL X190ML LISO PERFE;2834;0;0;0;0
477471;AC SEDAL X190ML CARBON;2834;0;0;0;0
477930;AC SEDAL SACHET x24un REST.INST;5499;0;0;0;0
478307;AC DOVE X400ML REGENERACI;5790;0;0;0;0
478597;AC ESTRELLA DP X180ML EQUILIBRIO;1468;0;0;0;0
478600;AC ESTRELLA DP X180ML RESTAURACI;1468;0;0;0;0
478601;AC ESTRELLA DP X180ML NUTRICION;1468;0;0;0;0
478672;AC PANTENE X400ML VOLUMEN;5999;0;0;0;0
478674;AC PANTENE X400ML KERATINA;5999;0;0;0;0
478678;AC PANTENE X400ML HIDRATA;5999;0;0;0;0
479081;AC SEDAL BALANCE x650cc;7599;0;0;0;0
479082;AC SEDAL LUMINUS x650cc;6990;0;0;0;0
479083;AC SEDAL REST.INST. x650cc;6990;0;0;0;0
479086;AC SEDAL DP X300ML REST.IST.;2949;0;0;0;2990
479090;AC SEDAL DP X300ML BALANCE;2949;0;0;0;2990
479126;AC SEDAL DP X300ML CERAMIDAS;2949;0;0;0;2990
479157;AC ESTRELLA VS X250ML;3673;0;0;0;0
479277;AC SUAVE X930ML BRILLO;3149;0;0;0;3190
479278;AC SUAVE X930ML FUERZA;3149;0;0;0;3190
479279;AC SUAVE X930ML SUAVIDAD;3149;0;0;0;3190
479280;AC SUAVE X930ML HIDRATACIO;3149;0;0;0;3190
479284;AC SUAVE X930ML DETOX;3149;0;0;0;3190
479295;AC PLUSBELLE X1LT BALANCE;3149;0;0;0;3290
479296;AC PLUSBELLE X1LT FUERZA;3149;0;0;0;3290
479297;AC PLUSBELLE X1LT HIDRATACIO;3149;0;0;0;3290
479298;AC PLUSBELLE X1LT REACTIVAC;3149;0;0;0;3290
479299;AC PLUSBELLE X1LT FRESCURA;3149;0;0;0;3290
479300;AC PLUSBELLE X1LT NUTRICION;3149;0;0;0;3290
479305;AC PLUSBELLE X1LT BRILLO;3149;0;0;0;3290
479306;AC PLUSBELLE X1LT SUAVIDAD;3149;0;0;0;3290
479307;AC PLUSBELLE X1LT PROTECCION;3149;0;0;0;3290
479308;AC PLUSBELLE X1LT VITALIDAD;3149;0;0;0;3290
479310;AC PLUSBELLE X1LT DETOX;3149;0;0;0;3290
479327;AC SEDAL JENGIBRE Y RICINO x650cc;6990;0;0;0;0
479332;AC FRUCTIS GARNIER AGUA C/COCO X35CC;6183;0;0;0;0
479333;AC SEDAL CARBON x650cc;6990;0;0;0;0
479468;AC TRESEMME HIDRA. PROFUN. x200cc;4199;0;0;0;0
479925;AC SEDAL SACHET x24 CERAMIDAS;5499;0;0;0;0
479932;AC PLUSBELLE ESENC NUTRICION x700cc;2519;0;0;0;0
479989;AC SEDAL HIALURONICO+VITA A X650ML;6990;0;0;0;0
479993;AC SEDAL COLAGENO REG X650ML;6990;0;0;0;0
479994;AC SEDAL PREBIOTICOS FUERZ X650ML;6990;0;0;0;0
480302;GEL DUCHA ALGABO KAR-AGU x350g;2204;0;0;0;0
480351;AC SEDAL X190ML LUMINOUS;2834;0;0;0;0
480352;AC SEDAL X190ML PREB/BIOT;2834;0;0;0;0
480525;AC SEDAL PREBIOTICOS X340ML;4198;0;0;0;0
480526;AC SEDAL LUMINOUS X340ML;4198;0;0;0;0
480534;ACOND KERATINA VEG EST TIO NACHO x415ml;7999;0;0;0;0
482120;AC SEDAL DP LUMINOUS X300ML;2949;0;0;0;0
231;ESPUMA D/AFEITAR GILLETTE x175g;7799;0;0;0;0
2433;ESPUMA D/AFEITAR NIVEA FOR MEN x1u;2999;0;0;0;0
4231;ESPUMA D/AFEITAR GILLETTE x312g;10990;0;0;0;0
4233;ESPUMA D/AFEITAR GILLETTE MENTHOL x312g;10999;0;0;0;0
5135;ESPUMA D/AFEITAR GILLETE CITRIC x312g;8999;0;0;0;0
5422;ESPUMA D/AFEITAR ALGABO MEN x415g;3899;0;0;0;0
7912;ESPUMA D/AFEITAR GILLETTE x150g;6999;0;0;0;0
462953;ESPUMA D/AFEITAR GILLETTE SENSIT x150g;5989;0;0;0;0
470657;GEL MODELADOR 317 x180gr;1149;0;0;0;0
470658;GEL EXTRA FUERTE 317 x180gr;1149;0;0;0;0
471480;CREMA D/AFEITAR MENTHOL PREAL x200g;1612;0;0;0;0
473253;ESPUMA D/AFEITAR MCGREGOR x220ml;2499;0;0;0;0
475551;ESPUMA D/AFEITAR GILLETTE SENSIT x312g;8999;0;0;0;0
480340;CREMA DE AFEITAR GILLETTE C/ALOE x150cc;5499;0;0;0;0
480341;ESPUMA DE AFEITAR GILLETTE FOAMY x312cc;11199;0;0;0;0
1686;VAPORIZADOR COLBERT US x60ml;12999;0;0;0;0
1701;VAPORIZADOR COLBERT ORIGINAL x60ml;11999;0;0;0;8999
5413;COLONIA ALGABO LILI GARDEN x400cc;4999;0;0;0;0
7159;PERFUME MUJERCITAS x40ml;7699;0;0;0;0
7160;PERFUME MUJERCITAS x80ml;8399;0;0;0;0
7162;PERFUME PACO x90ml;8499;0;0;0;0
7163;VAPORIZADOR KEVIN PLATINUM x50ml;24999;0;0;0;0
7164;VAPORIZADOR KEVIN ABSOLUTE x60ml;24999;0;0;0;0
7165;VAPORIZADOR KEVIN BLACK x60ml;16999;0;0;0;0
7166;VAPORIZADOR KEVIN SPIRIT x60ml;14699;0;0;0;0
7167;VAPORIZADOR CHESTER ICE x60ml;11999;0;0;0;0
7170;VAPORIZADOR CIEL ROSE x50ml;15224;0;0;0;0
7172;VAPORIZADOR FLOWER ROSE x40ml;10999;0;0;0;0
7173;VAPORIZADOR L'XTREME x40ml;10999;0;0;0;0
7661;PERFUME PACO x60ml;8398;0;0;0;8890
7663;PERFUME COQUETERIAS x90ml;7559;0;0;0;0
7755;VAPORIZADOR KEVIN ROJO x60ml;15749;0;0;0;0
7885;VAPORIZADOR KEVIN PARK x60ml;16999;0;0;0;0
7886;VAPORIZADOR CIEL CELESTE x50ml;15224;0;0;0;0
7887;VAPORIZADOR CIEL NUIT x50ml;15224;0;0;0;0
7888;VAPORIZADOR CIEL CRISTAL x50ml;16799;0;0;0;0
7892;VAPORIZADOR PRUNE x50ml VARIOS;22049;0;0;0;0
7896;LOCION CHESTER ICE X100ML;10351;0;0;0;0
8225;NECESER CIEL NUIT;30449;0;0;0;0
8227;NECESER CIEL CELESTE;30449;0;0;0;0
8247;VAPORIZADOR COLBERT ACQUA x60ml;13999;0;0;0;0
9678;VAPORIZADOR COLBERT PINO x60ml;10079;0;0;0;0
9679;VAPORIZADOR COLBERT NOIR x60ml;12999;0;0;0;0
9680;VAPORIZADOR CHESTER ICE x100ml;10351;0;0;0;0
9683;VAPORIZADOR VARIAS FRAGANCIAS TUCU;4504;0;0;0;0
10176;VAPORIZADOR CIEL PARADISE x50ml;14699;0;0;0;0
10726;PERFUME GIOGRASSE;3674;0;0;0;0
10737;VAPORIZADOR PAULA CAHEN x60ml;29999;0;0;0;0
10738;VAPORIZADOR CARO CUORE ROJO 60ml;26999;0;0;0;0
10740;VAPORIZADOR BROSS LONDON BLUE x100ml;24999;0;0;0;0
10741;VAPORIZADOR BROSS LONDON WARRIOR x100ml;23519;0;0;0;0
10742;VAPORIZADOR BROSS LONDON CLASSIC x100ml;24999;0;0;0;0
11210;VAPORIZADOR KEVIN FREEDOM 60 ML;20999;0;0;0;0
12303;VAPORIZADOR CIEL LOVE EAU 60ML;13964;0;0;0;0
460516;VAPORIZADOR PAULA CAHEN AMOR x60ml;29999;0;0;0;0
460517;VAPORIZADOR PAULA CAHEN LUZ x60ml;29999;0;0;0;0
460742;VAPORIZADOR MUJERCITAS x40ml;8999;0;0;0;0
460793;KEVIN BLACK (PERFUME+DESOD);20990;0;0;0;0
460841;VAPORIZADOR COLBERT SPACE x60ml;13999;0;0;0;0
461051;VAPORIZADOR PAULA CAHEN ALMA x60ml;26249;0;0;0;0
461361;VAPORIZADOR PALOMA H.CLAS x60ml;26249;0;0;0;0
461369;VAPORIZADOR BOGANI TOUT NOIR x60ml;30999;0;0;0;0
461388;PERFUME MESSI LATA 55ml;829;0;0;0;0
461389;PACK KOSIUKO ROSE x150cc;829;0;0;0;0
462975;VAPORIZADOR CIEL NOIR x50ml;19999;0;0;0;0
463336;VAPORIZADOR BOGANI CHIC x60ml;30999;0;0;0;0
463337;VAPORIZADOR BOGANI POUR FEMME x60ml;30999;0;0;0;0
466243;ROUTE 66 PERFUME x100c;10499;0;0;0;0
467579;VAPORIZADOR KEVIN METAL x60ml;24999;0;0;0;0
467844;VAPORIZADOR CIEL MAGIC x50ml;19999;0;0;0;0
468138;VAPORIZADOR ANA BY A.M x75ml;31999;0;0;0;0
469170;VAPORIZADOR COLBERT CODE BOLD X50CC;11024;0;0;0;0
469679;CHESTER ICE (PERFUME+DESOD);17840;0;0;0;0
469681;NECESER KEVIN SPIRIT;20990;0;0;0;0
469683;ACQUA DI COLBERT (PERFUME+DESOD);18155;0;0;0;0
469684;NECESER KEVIN ROJO;20990;0;0;0;0
470321;PERFUME DISNEY ARGOS;3638;0;0;0;0
470366;VAPORIZADOR CIEL MAGIG x80ml;14037;0;0;0;0
470367;VAPORIZADOR KEVIN ROJO x100ml;4837;0;0;0;0
471234;VAPORIZADOR CARO CUORE AMORE x60ml;26999;0;0;0;0
471235;VAPORIZADOR LAS PEPAS x100ml;32444;0;0;0;0
472383;VAPORIZADOR KEVIN ICE x60ml;14999;0;0;0;0
473391;VAPORIZADOR PALOMA H.FANTASY x60ml;26249;0;0;0;0
473889;VAPORIZADOR SENS GROSELLAS ROSAS x100ml;17849;0;0;0;0
473892;VAPORIZADOR SENS VERBENA NARANJA x100ml;17849;0;0;0;0
474714;NECESER CIEL NOIR NEGRO;19949;0;0;0;0
475069;NECESER CIEL LOVE;30449;0;0;0;0
475441;VAPORIZADOR VALERIA BY VALERIA MAZZ 100CC;24149;0;0;0;0
475444;VAPORIZADOR CIEL CELESTE X80CC;14173;0;0;0;0
475529;NECESSER CIEL GRANDE PERFUME+DESOD;30449;0;0;0;0
475916;VAPORIZADOR KEVIN RED x60ml;24999;0;0;0;0
476635;SET MUJER CREMA+BODYSPLASH ALGABO;6289;0;0;0;0
477345;BOLSITO SENS PERF+DESOD;31499;0;0;0;0
477488;VAPORIZADOR PALOMA H.PASSION x60ml;26249;0;0;0;0
477899;PERFUME CARROZA CENICIENTA IMP-E;14437;0;0;0;0
478175;PERFUME CAPSULA BATMAN x50cc;5081;0;0;0;0
478182;PERFUME MOANA x50cc;3811;0;0;0;0
478184;PERFUME INF WONDER WOMAN x50cc;4999;0;0;0;0
478188;PERFUME INF TRANFORMERS x50cc;5659;0;0;0;0
478190;PERFUME MOANA VENTANA x50cc;4619;0;0;0;0
478195;PERFUME MICKEY x50cc;3999;0;0;0;0
478197;PERFUME CAPSULA SUPERMAN x50cc;4999;0;0;0;0
478198;PERFUME CAPSULA LOL x50cc;4999;0;0;0;0
478199;PERFUME INF MULTI PIXAR x50cc;6299;0;0;0;0
478200;PERFUME LOL C/STICKERS x50cc;4999;0;0;0;0
478203;PERFUME CORONA JAZMIN x50cc;5081;0;0;0;0
478261;PERFUME INFANTIL SUPERMAN x50cc;5144;0;0;0;0
478782;BROSS LONDON GOLD VAPORIZADOR x100cc;23519;0;0;0;0
478862;KEVIN ICE (PERFUME+DESOD);19940;0;0;0;0
479140;VAPORIZADOR CIEL SHINE x50cc;19999;0;0;0;0
479435;NECESSER FLOWER ROSE GRANDE PERF+DES.;27194;0;0;0;0
479527;VAPORIZADOR CARO CUORE CUORE x60cc;26999;0;0;0;0
479528;VAPORIZADOR VALERIA MAZZA VELVET x60cc;25199;0;0;0;0
480333;VAPORIZADOR AFEEF VARIOS X1UN;2308;0;0;0;2199
480564;VAPORIZADOR ANA MAIORANA GLAM x75cc;31999;0;0;0;0
1164;COLONIA J&J BABY BESITOS x200ml;7348;0;0;0;0
5416;COLONIA ALGABO BLUSH PETALS x400cc;4999;0;0;0;0
5671;BABY COLONIA DCES SUEÑOS J&J 100ML;4198;0;0;0;0
5672;COLONIA J&J BABY x100ml;4198;0;0;0;0
5684;BABY COLONIA SONRISAS J&J 100ML;4198;0;0;0;0
7428;COLONIA J&J BABY DCES SUEÑOS X200ml;7348;0;0;0;0
7429;COLONIA J&J BABY FRES.CARICIA X200ml;7348;0;0;0;0
8351;COLONIA ALGABO AMBRE X500ml;3899;0;0;0;0
8352;COLONIA ALGABO LAVANDA X500ml;3899;0;0;0;0
8353;COLONIA INGLESA ALGABO 500ML;3899;0;0;0;0
8951;COLONIA ALGABO INGLESA X750ml;3464;0;0;0;0
10279;BODY SPLASH HELLO KITTY x125ml;4189;0;0;0;0
10293;COLONIA CAPITAN AMERICA 125ml;4199;0;0;0;0
10294;COLONIA HELLO KITTY BODY SPLASH 125ml DULZURA;4189;0;0;0;0
10635;VAPORIZADOR CRANDALL X95cc;9658;0;0;0;0
10739;COLONIA PIBES 80ml;8499;0;0;0;6899
462898;COLONIA +LATA ALCANCIA ANGRY BIRDS;1016;0;0;0;0
463277;COLONIA J&J FRESCAS CARICIAS x100cc;3989;0;0;0;0
465234;COLONIA ALGABO BABY S.B/D.M X200cc;3199;0;0;0;0
465235;COLONIA ALGABO BABY MIMOS X100cc;1889;0;0;0;0
471236;VAPORIZ.MUJERCITAS JULIE-SOPHIE X50m;12914;0;0;0;0
471658;VAPORIZ.PAULA ALEGRIA X60ml;29999;0;0;0;0
473057;COLONIA+SHAMPOO ZOMBIES VALIJA ALGABO;5249;0;0;0;0
475603;COLONIA PATRICIA ALLEN INGLESA x500cc;1049;0;0;0;0
476632;SET BODYSPLASH+SH ALGABO PAW PATROL;6289;0;0;0;0
478186;BOBY SPLASH MY LITTLE PONY X65cc;3811;0;0;0;0
478187;BODY SPLASH STICH x65cc;3999;0;0;0;0
478189;BODY SPLASH LIGHTYEAR x65cc;3811;0;0;0;0
478201;BODY SPLASH FLASH 65cc;3811;0;0;0;0
478996;VAPORIZADOR CIEL NUIT 80ML;14173;0;0;0;0
431;DESODORANTE REXONA MEN x150ml ANTIB FRES;3999;0;0;0;3749
1161;DESODORANTE DOVE x150ml ORIGINAL;4499;0;0;0;4549
1163;DESODORANTE DOVE x150ml POMELO;4499;0;0;0;4549
1247;DESODORANTE REXONA WOMEN x150g ACTIV EMOT;3999;0;0;0;0
2627;DESODORANTE PATRICHS AVIATOR x150ml;3149;0;0;0;0
2628;DESODORANTE PATRICHS LUOMO X150CC;3569;0;0;0;0
2629;DESODORANTE PATRICHS NOIR X150CC;3569;0;0;0;0
3905;DESODORANTE NIVEA MEN x150ml VARIOS;2939;0;0;0;0
4064;DESODORANTE REXONA WOMEN x150g COTTON DRY;3999;0;0;0;3749
4330;DESODORANTE DOVE x150ml INVISIBL C;4499;0;0;0;4549
4336;DESODORANTE COLBERT x250ml VARIOS US;5499;0;0;0;0
4337;DESODORANTE COLBERT x250ml VARIOS ACQUA DI;5499;0;0;0;0
4338;DESODORANTE COLBERT x150ml VARIOS;4199;0;0;0;0
4692;DESODORANTE COLBERT x250ml VARIOS NOIR;5499;0;0;0;0
5022;DESODORANTE REXONA MEN x150ml HOMBRE;3999;0;0;0;3749
5115;DESODORANTE COLBERT x250ml VARIOS PINO;5499;0;0;0;0
5249;DESODORANTE REXONA MEN x150ml SPORT;3999;0;0;0;3749
6796;DESODORANTE AXE VARIOS x150cc;3799;0;0;0;0
6845;DESODORANTE AXE GREEN GERANIUM x150cc;3799;0;0;0;0
6846;DESODORANTE AXE MARINE x150cc;3999;0;0;0;0
6848;DESODORANTE AXE BLUE LAVENDER x150cc;3799;0;0;0;0
7064;DESODORANTE CIEL x123ml CELESTE;4399;0;0;0;0
7065;DESODORANTE CIEL x123ml CRISTAL;4399;0;0;0;0
7066;DESODORANTE CIEL x123ml NUIT;4399;0;0;0;0
7067;DESODORANTE KEVIN x150ml VARIOS;4499;0;0;0;0
7069;DESODORANTE KEVIN X150ml ROJO;3799;0;0;0;0
7145;DESODORANTE PAULA CAHEN DANV x123ml CLASICO;4699;0;0;0;0
7150;DESODORANTE CHESTER ICE X 150ML;4199;0;0;0;0
7151;DESODORANTE PAULA CAHEN DAN x123ml AMOR;4699;0;0;0;0
7152;DESODORANTE PAULA CAHEN DAN x123ml LUZ;4699;0;0;0;0
7153;DESODORANTE PRUNE x123ml VARIOS;4409;0;0;0;0
7157;DESODORANTE CIEL x123ml ROSE;4399;0;0;0;0
7392;DESODORANTE KEVIN ABS/PLAT X250CC;5499;0;0;0;0
7393;DESODORANTE KEVIN SPIRIT x250ml;5499;0;0;0;0
7395;DESODORANTE KEVIN ROJO X250CC;5499;0;0;0;0
7396;DESODORANTE KEVIN PARK x250ml;5499;0;0;0;0
7397;DESODORANTE CHESTER ICE X250CC;5499;0;0;0;0
7544;DESODORANTE REXONA MEN x150ml INVISIBLE;3999;0;0;0;3749
7700;DESODORANTE NIVEA FEM x150ml VARIOS;2938;0;0;0;0
7762;DESODORANTE REXONA MEN x150ml V8;3999;0;0;0;3749
7878;DESODORANTE REXONA MEN x150ml XTRACOOL;3999;0;0;0;3749
7889;DESODORANTE COLBERT x250ml VARIOS SPACE;5499;0;0;0;0
7905;DESODORANTE CANNON ROSE x123ml;4399;0;0;0;0
7906;DESODORANTE CANNON LEXTREME X 123ML;4499;0;0;0;0
7907;DESODORANTE GINO BOGANI CHIC TO CHEEK x123ml;4699;0;0;0;0
7908;DESODORANTE GINO BOGANI POUR FEMME x123ml;4699;0;0;0;0
8579;DESODORANTE CIEL x123ml PARADISE;4399;0;0;0;0
8848;DESODORANTE DOVE x150ml EXTRA FRES;4499;0;0;0;4549
8993;DESODORANTE CARO CUORE ROJO x123ml;4699;0;0;0;0
9049;DESODORANTE PAULA CAHEN DAN x123ml ALMA;4699;0;0;0;0
9677;DESODORANTE CIEL x123ml DETE;4399;0;0;0;0
10493;DESODORANTE OLD SPICE X 150ML;4933;0;0;0;0
10743;DESODORANTE BROSS LONDON BLUE x150ml;4899;0;0;0;0
10744;DESODORANTE BROSS LONDON WARRIOR x150ml;4899;0;0;0;0
10745;DESODORANTE BROSS LONDON CLAS X150CC;4899;0;0;0;0
10753;DESODORANTE DOVE x150ml INVISIBL D;4499;0;0;0;4549
10980;DESODORANTE PAULA CAHEN DANVER X 123ML;3464;0;0;0;0
60555;DESODORANTE AXE DARK TEMPT X150ML;3999;0;0;0;0
60556;DESODORANTE AXE MUSK X150ML;3999;0;0;0;0
60610;DESODORANTE AXE FIFA WORLD X150ML;3799;0;0;0;0
460554;DESODORANTE REXONA WOMEN x150g FOOTBALL;3999;0;0;0;3749
460741;DESODORANTE KEVIN FREEDOM X250CC;5499;0;0;0;0
460831;DESODORANTE PLUSBELLE U.SEC ANTIT 210ML;1259;0;0;0;0
461359;DESODORANTE PALOMA HERRERA PASSION x123ml;4699;0;0;0;0
461360;DESODORANTE GINO BOGANI TOUT NOIR x123ml;4699;0;0;0;0
461423;DESODORANTE PACO FUTBOL x150ml;3999;0;0;0;0
461424;DESODORANTE MUJERCITAS x123ml;3999;0;0;0;0
461654;DESODORANTE DOVE x150ml PEPINO;4499;0;0;0;4549
462615;DESODORANTE NIVEA PROMO NIVEA x150cc;1469;0;0;0;0
462974;DESODORANTE CIEL x123ml NOIR;4399;0;0;0;0
462992;DESODORANTE DOVE x150ml PERA;4499;0;0;0;4549
463015;DESODORANTE IMPULSE VARIOS X 150ML;1468;0;0;0;0
463328;DESODORANTE DOVE x150ml MEN VARIOS;4499;0;0;0;4549
463333;DESODORANTE COQUETERIAS FLOWER x123ml;3999;0;0;0;0
463920;DESODORANTE PALOMA HERRERA CLASICO x123ml;4699;0;0;0;0
464703;DESODORANTE PATRICH LUOMO X 241CC;3358;0;0;0;0
464949;DESODORANTE IMPULSE MUSK X 150ML;2999;0;0;0;0
465440;DESODORANTE SUAVE VARIOS x150cc;714;0;0;0;0
465528;DESODORANTE AXE ANARCHY MUJER x150cc;3148;0;0;0;2799
467092;DESODORANTE ODORONO X150CC;3569;0;0;0;0
467758;DESODORANTE ANA MAIORANA X123CC;4699;0;0;0;0
467759;DESODORANTE CIEL x123ml LOVE;4399;0;0;0;0
468672;DESODORANTE REXONA CLINICAL FEM 150CC;5836;0;0;0;0
468717;DESODORANTE COLBERT x250ml VARIOS CLASICO;5499;0;0;0;0
468718;DESODORANTE CIEL x123ml MAGIC;4399;0;0;0;0
468950;DESODORANTE KEVIN METAL X250CC;5499;0;0;0;0
470235;DESODORANTE KEVIN BLACK x250ml;5499;0;0;0;0
470281;DESODORANTE DOVE x150ml COCO JAZMI;4499;0;0;0;4549
470283;DESODORANTE DOVE x150ml GRANADA;4499;0;0;0;4549
470539;DESODORANTE PATRICHS GRAND PRIX x150ml;3149;0;0;0;0
470540;DESODORANTE BLACK LABEL PATRICHS x150ml;2624;0;0;0;2599
470541;DESODORANTE REXONA MEN x150ml SENSITIVE;3999;0;0;0;3749
470542;DESODORANTE REXONA MEN x150ml EXTRA FRES;3999;0;0;0;3749
470543;DESODORANTE REXONA MEN x150ml ANTIBACTER;3999;0;0;0;3749
470544;DESODORANTE REXONA WOMEN x150g BAMBOO ALO;3999;0;0;0;3749
470545;DESODORANTE REXONA WOMEN x150g INVISIBLE;3999;0;0;0;3749
470546;DESODORANTE REXONA WOMEN x150g FANATICAS;3999;0;0;0;3749
470549;DESODORANTE REXONA WOMEN x150g ANTIBACTER;3999;0;0;0;3749
470550;DESODORANTE REXONA MEN x150ml FANATICOS;3999;0;0;0;3749
470553;DESODORANTE REXONA CLINICAL MEN 110CC;8399;0;0;0;0
471121;DESODORANTE DUFOUR MEN VARIOS x125ML;1199;0;0;0;0
471126;DESODORANTE DUFOUR x125g WOMEN;1259;0;999;0;0
471237;DESODORANTE CARO CUORE AMORE x123ml;4699;0;0;0;0
471238;DESODORANTE LAS PEPAS x123ml;4094;0;0;0;0
471337;DESODORANTE REXONA WOMEN x150g SPORT;3999;0;0;0;3749
471338;DESODORANTE REXONA WOMEN x150g NUTRITIVE;3999;0;0;0;3749
471659;DESODORANTE PAULA CAHEN DAN x123ml ALEGRIA;4699;0;0;0;0
471951;DESODORANTE DUFOUR WOMEN INF. x123ml;999;0;0;0;0
472270;DESODORANTE KEVIN ICE x250ml;5499;0;0;0;0
473192;DESODORANTE CRANDALL x250cc;5499;0;0;0;0
473216;DESODORANTE JULIE/SOFHIE X123CC;3999;0;0;0;0
473250;DESODORANTE MACGREGOR X97G VARIOS;1448;0;0;0;0
473252;DESODORANTE MACGREGOR MEN 170CC;2699;0;0;0;0
473390;DESODORANTE PALOMA HERRERA FANTASY x123cc;4699;0;0;0;0
474275;DESODORANTE SENS VS X123CC;4094;0;0;0;0
474340;DESODORANTE REXONA EMOT/COTT x250cc;4599;0;0;0;0
474384;DESODORANTE REXONA MEN V8 X250CC;4599;0;0;0;0
475137;DESODORANTE DOVE CLASICO x250cc;5499;0;0;0;0
475914;DESODORANTE AEROSOL KEVIN RED x150cc;5039;0;0;0;0
475915;DESODORANTE KEVIN RED X250CC;5499;0;0;0;0
475917;DESODORANTE REXONA WOMEN x150g ACTIVE EMO;3999;0;0;0;3749
476212;DESODORANTE KEVIN ROJO S/A x163ml;4934;0;0;0;0
476217;DESODORANTE KEVIN ICE S/A x163ml;4934;0;0;0;0
476703;DESODORANTE REXONA MEN X150ML JULIAN AL;3999;0;0;0;0
477159;DESODORANTE DOVE CARE PROT TOT X250ML;5299;0;0;0;0
477232;DESODORANTE CIEL x123ml SHINE;4399;0;0;0;0
477412;DESODORANTE PACO SURF x150ML;3999;0;0;0;0
477413;DESODORANTE PACO CLASIC x150ML;3999;0;0;0;0
477414;DESODORANTE AXE BLACK x150cc;3799;0;0;0;0
477415;DESODORANTE AXE APOLLO 72hr x150ml;3799;0;0;0;0
477416;DESODORANTE AXE TEMPTATION 72hs x150ml;3148;0;0;0;2799
477417;DESODORANTE AXE APOLLO CIT 48HS x150ml;2799;0;0;0;0
477477;DESODORANTE REXONA MEN XTRACOOL x250cc;4599;0;0;0;0
477948;DESODORANTE AXE MUSK XL x230ml;4514;0;0;0;0
478161;DESODORANTE AXE MARINE XL 230CC;4514;0;0;0;0
478282;DESODORANTE VALERIA MAZZA 123CC;4699;0;0;0;0
478432;DESODORANTE BROSS LONDON GOLD X150CC;4899;0;0;0;0
478436;DESODORANTE ANA GLAM BY ANALIA MAIORANA x123ml;4699;0;0;0;0
478756;DESODORANTE AXE PEACH INFUSION X150CC;3149;0;0;0;2799
478770;DESODORANTE AXE PURE COCONUT X150gr;3149;0;0;0;0
478772;DESODORANTE AXE AQUA CITRUS X150C;3799;0;0;0;0
479162;DESODORANTE DOVE x150ml S/PERF;4499;0;0;0;4549
479379;DESODORANTE VALERIA VELVET AEROSOL x123cc;4699;0;0;0;0
479419;DESODORANTE CARO CUORE x123ml;4699;0;0;0;0
479591;DESODORANTE PATRICHS X231ML ACQUA;4093;0;0;0;0
479596;DESODORANTE PATRICHS X231ML GRAND PRIX;4093;0;0;0;0
479735;DESOD. REXONA CORPORAL FEMENINO x150cc;4619;0;0;0;0
479736;DESOD. REXONA CORPORAL MASCULINO x150cc;4619;0;0;0;0
479980;DES REXONA AER CLINICAL MEN x150cc;5836;0;0;0;0
480079;DOVE CLINICAL FEM;6298;0;0;0;0
480301;DESODORANTE ROLL ON MEN ALGABO x60g;1364;0;0;0;0
480303;DESODORANTE ALGABO ROLL ON FRES/BEA X60cc;1364;0;0;0;0
480304;DESODORANTE ALGABO ROLL ON PUR/SOFT X60cc;1364;0;0;0;0
480338;DESODORANTE PATRICHS X231ML GOLD LABEL;4093;0;0;0;0
480952;DESODORANTE KEVIN DUBAI X250cc;5499;0;0;0;0
480953;DESODORANTE PAULA AURA X123cc;4699;0;0;0;0
1767;JABON TOC.DOVE ORIGINAL CREM x90gr;1899;0;0;0;0
1787;JABON TOC.PLUSBELLE VARIOS X 120GR;838;0;0;0;0
1790;JABON TOC.REXONA VARIOS x120/125gr;1179;0;0;0;0
1804;JABON TOC.PALMOLIVE VARIOS X 150GR;1048;0;0;0;0
1810;JABON TOC.LIMOL VARIOS X 3X90GR;1433;0;0;0;0
1981;JABON TOC.VERITAS BEBE X120G;847;0;0;0;0
1987;JABON TOC.NIVEA CREMOSO SOFT X100G;847;0;0;0;0
2024;JABON TOC.ASEPXIA EXFOLIANTE X100G;3979;0;0;0;0
2192;JABON TOC.ASEPXIA EXFOLIANTE FORTE X100;3979;0;0;0;0
3115;JABON TOC PLUSBELLE ESENCIA RELAX x120gr;838;0;0;0;0
4977;JABON ASEPXIA HIDRO-F FORTE x100g;4619;0;0;0;0
5050;JABON TOC.SUAVE X3U;1575;0;0;0;0
5095;JABON TOC.ASEPXIA EXFOLIANTE AZUF.X100G;3464;0;0;0;0
5202;JABON TOC.PLUSBELLE 3UN COCO VAINI;2749;0;0;0;2739
5203;JABON TOC.PLUSBELLE 3UN JAZMIN INT;2749;0;0;0;2739
5436;JABON LIQ.GREEN TEA ALGABO X 300ML;1653;0;0;0;0
5437;JABON LIQ.ALGABO FLORAL X 300ML;1784;0;0;0;0
5438;JABON LIQ.ALGABO COCO/VAI X 300ML;1784;0;0;0;0
5439;JABON LIQ.ALGABO GREEN DP X 300ML;1199;0;0;0;0
5440;JABON LIQ.ALGABO FRUTOS DP X 300ML;1199;0;0;0;0
5441;JABON LIQ.ALGABO COCO/VAI DP X 300ML;1199;0;0;0;0
5442;JABON LIQ.ALAGABO ANTIBACT X 300ML;2193;0;0;0;0
5552;JABON LIQ.ALGABO FLORAL RAIN X 300ML;1199;0;0;0;0
5658;JABON TOC. PLUSBELLE NUTRI COCO x120g;838;0;0;0;0
5659;JABON TOC. PLUSBELLE RAD.FLORES x120g;838;0;0;0;0
6051;JABON TOC.LUX VARIOS x125gr;1048;0;0;0;0
6109;JABON TOC.REXONA VARIOS X 3UNID.;3399;0;0;0;3190
6289;JABON TOC.SIGNO 90gr x3UN;1574;0;0;0;0
6337;JAB.TOC CAMPOS VERDES PAUSA EN CAMPOx120g;734;0;0;0;0
6376;JAB.TOC CAMPOS VERDES FRESC LIBERARDx120g;734;0;0;0;0
6380;JAB.TOC CAMPOS VERDES ENERGIA D/SOL x120g;734;0;0;0;0
6432;JABON TOC.PLUSBELLE 3UN LAVANDA;2749;0;0;0;0
6731;JABON TOC.ANTIBAC.ESPADOL VARIOS X90G;1258;0;0;0;0
6755;JABON TOC.PATRICIA ALLEN 3X80GR;1469;0;0;0;0
6847;JABON LIQ.PALMOLIVE C/VALV X 221ML;1163;0;0;0;0
6851;JABON LIQ.PALMOLIVE 250ML S/VALV;3044;0;0;0;0
6950;JABON TOC.LIMOL FLORES CITRICAS XUNI;483;0;0;0;0
7219;JABON TOC.CUPIDO x3un;1349;0;0;0;0
7220;JABON TOC.ARGENTINO 3X80G;1379;0;0;0;0
8348;JABON LIQ.ALGABO COCO/LAV X 500ML;2309;0;0;0;0
8357;JABON LIQ.ALGABO CREAM DP 300ML;1199;0;0;0;0
8358;JABON LIQ.ALGABO MIX CREM X 300ML;1784;0;0;0;0
8512;JABON LIQ.ALGABO CITRUS X 300ML;1199;0;0;0;0
8586;JABON TOC.VERITAS VARIOS x120GR;2204;0;0;0;0
9308;JABON TOC.LUX VARIOS X 3U;3399;0;0;0;0
9522;JABON LIQ.ALGABO FLOWER X 300ML;1199;0;0;0;0
9523;JABON LIQ.ALGABO FTOS BOSQUE X 300ML;1652;0;0;0;0
9633;JABON TOC.PROTEX VARIOS x125g;1627;0;0;0;0
10315;JABON LIQ.PROTEX X221ML C/VALV;3571;0;0;0;0
10318;JABON LIQ.PROTEX X 250ML S/VALV;3884;0;0;0;0
12094;JABON NEUTRO ASEPXIA x100g;3526;0;0;0;0
460242;JABON TOC.SIGNO C/GLICERINA X 90GR;577;0;0;0;0
460309;JABON TOC.ESTRELLA BABY X 90GR;1041;0;0;0;0
460495;JABON LIQ.ALGABO CREMOSO C/V X 300ML;1784;0;0;0;0
460743;JABON TOC.PATRICIA ALLEN X 130GR;839;0;0;0;0
461046;JABON TOC.DOVE BABY VARIOS X 75GR;1573;0;0;0;0
461068;JABON TOC.ESPADOL X3;3674;0;0;0;0
461080;JABON TOC.VERITAS VARIOS 3UN;2267;0;0;0;0
461311;JABON TOC.PALMOLIVE VARIOS x125gr;716;0;0;0;0
461710;JABON TOCADOR JOHNSONS VARIOS X 80G;1048;0;0;0;0
462309;JABON LIQ.ALGABO STAR WARS X 500CC;8869;0;0;0;0
462923;ESP.BAÑO ALGABO FROZEN 3D x400cc;4199;0;0;0;0
462954;JABON TOC.POLYANA VARIOS 125GR;699;0;0;0;0
463182;JABON TOC.J&J 80GR;1642;0;0;0;0
463525;JABON TOC.ESTRELLA VARIOS X 130GR;936;0;0;0;0
464015;JABON TOC.ALGABO BABY X 80GR;771;0;0;0;0
464120;JABON TOC.ESTRELLA X 3UNID;2590;0;0;0;0
464283;JABON TOC.ESTRELLA BABY X 75GR;1322;0;0;0;0
464301;JABON TOC.ASEPXIA EXFOLIANTE CARBON;4198;0;0;0;0
464322;JABON TOC.REXONA ANTIBACTERIAL X90G;838;0;0;0;0
464676;JABON TOC.DOVE 3X90GR;5249;0;0;0;0
464884;JABON TOC.PATRICIA ALLEN VARIOS X90G;734;0;0;0;0
